{"run":74,"commit":"a909d03","metric":17,"metrics":{"database_failures":0,"database_passed":153,"auth_failures":0,"auth_passed":66,"globals_failures":0,"globals_passed":13,"collections_rest_failures":0,"collections_rest_passed":112,"collections_graphql_failures":0,"collections_graphql_passed":47,"fields_failures":0,"fields_passed":157,"sort_failures":0,"sort_passed":37,"select_failures":0,"select_passed":115,"field_paths_failures":0,"field_paths_passed":2,"query_presets_failures":0,"query_presets_passed":11,"relationships_failures":0,"relationships_passed":57,"joins_failures":3,"joins_passed":71,"uploads_failures":2,"uploads_passed":100,"dataloader_failures":0,"dataloader_passed":4,"versions_failures":0,"versions_passed":98,"localization_failures":0,"localization_passed":117,"trash_failures":0,"trash_passed":97,"locked_documents_failures":0,"locked_documents_passed":13,"queues_failures":12,"queues_passed":60,"plugin_nested_docs_failures":0,"plugin_nested_docs_passed":11,"plugin_redirects_failures":0,"plugin_redirects_passed":3,"plugin_search_failures":0,"plugin_search_passed":20,"plugin_seo_failures":0,"plugin_seo_passed":6,"plugin_form_builder_failures":0,"plugin_form_builder_passed":53,"plugin_multi_tenant_failures":0,"plugin_multi_tenant_passed":9,"build_ok":1,"modularity_penalty":1523,"largest_src_file_lines":1045,"operations_lines":1045,"relationships_lines":733,"src_file_count":18,"large_src_files":3,"plugin_suites_enabled":1,"duration_s":1646.435},"status":"discard","description":"Extract localization read-transform helpers","timestamp":1779931302872,"segment":1,"confidence":343.3333333333333,"asi":{"hypothesis":"A behavior-preserving extraction of localization read-transform/pruning helpers from operations.ts into a focused utility should improve module separation while preserving current conformance.","result":"Architecture metrics improved substantially (modularity_penalty 1847→1523, operations_lines/largest_src_file_lines 1207→1045), but primary blocker_failures worsened from best 15 to 17 due to queues at 12 failures.","rollback_reason":"Conformance regression outweighs modularity improvement. The extraction is likely behavior-preserving, but cannot be kept while the full objective metric is worse than best.","next_action_hint":"This large localization extraction may be worth retrying only when queue noise is stable at 10 failures. Prefer true queue fixes or smaller low-risk refactors; avoid repeated large extraction retries if queues remain noisy."}}
