{"run":66,"commit":"3dc69a7","metric":15,"metrics":{"database_failures":0,"database_passed":153,"auth_failures":0,"auth_passed":66,"globals_failures":0,"globals_passed":13,"collections_rest_failures":0,"collections_rest_passed":112,"collections_graphql_failures":0,"collections_graphql_passed":47,"fields_failures":0,"fields_passed":157,"sort_failures":0,"sort_passed":37,"select_failures":0,"select_passed":115,"field_paths_failures":0,"field_paths_passed":2,"query_presets_failures":0,"query_presets_passed":11,"relationships_failures":0,"relationships_passed":57,"joins_failures":3,"joins_passed":71,"uploads_failures":2,"uploads_passed":100,"dataloader_failures":0,"dataloader_passed":4,"versions_failures":0,"versions_passed":98,"localization_failures":0,"localization_passed":117,"trash_failures":0,"trash_passed":97,"locked_documents_failures":0,"locked_documents_passed":13,"queues_failures":10,"queues_passed":62,"plugin_nested_docs_failures":0,"plugin_nested_docs_passed":11,"plugin_redirects_failures":0,"plugin_redirects_passed":3,"plugin_search_failures":0,"plugin_search_passed":20,"plugin_seo_failures":0,"plugin_seo_passed":6,"plugin_form_builder_failures":0,"plugin_form_builder_passed":53,"plugin_multi_tenant_failures":0,"plugin_multi_tenant_passed":9,"build_ok":1,"modularity_penalty":2111,"largest_src_file_lines":1339,"operations_lines":1339,"relationships_lines":733,"src_file_count":13,"large_src_files":3,"plugin_suites_enabled":1,"duration_s":1733.647},"status":"keep","description":"Extract atomic update path helpers for modularity","timestamp":1779916576829,"segment":1,"confidence":171.66666666666666,"asi":{"hypothesis":"A behavior-preserving extraction of atomic update path helpers from operations.ts into a focused utility should improve modularity while preserving the current best conformance state.","result":"Primary blocker_failures matched the current best at 15 while architecture metrics improved substantially: modularity_penalty dropped from 2233 to 2111, operations_lines/largest_src_file_lines dropped from 1400 to 1339, with green guardrails preserved.","learned":"The atomic update helper extraction is behavior-preserving when queue noise is favorable/equal to best, and cleanly separates dotted operator path handling from the large operations module.","next_action_hint":"Continue targeting true conformance blockers: queues remain around 10 failures, joins 3, uploads 2 local env. Future refactors can extract more coherent operations helpers only when full conformance remains equal."}}
{"run":67,"commit":"d311b94","metric":15,"metrics":{"database_failures":0,"database_passed":153,"auth_failures":0,"auth_passed":66,"globals_failures":0,"globals_passed":13,"collections_rest_failures":0,"collections_rest_passed":112,"collections_graphql_failures":0,"collections_graphql_passed":47,"fields_failures":0,"fields_passed":157,"sort_failures":0,"sort_passed":37,"select_failures":0,"select_passed":115,"field_paths_failures":0,"field_paths_passed":2,"query_presets_failures":0,"query_presets_passed":11,"relationships_failures":0,"relationships_passed":57,"joins_failures":3,"joins_passed":71,"uploads_failures":2,"uploads_passed":100,"dataloader_failures":0,"dataloader_passed":4,"versions_failures":0,"versions_passed":98,"localization_failures":0,"localization_passed":117,"trash_failures":0,"trash_passed":97,"locked_documents_failures":0,"locked_documents_passed":13,"queues_failures":10,"queues_passed":62,"plugin_nested_docs_failures":0,"plugin_nested_docs_passed":11,"plugin_redirects_failures":0,"plugin_redirects_passed":3,"plugin_search_failures":0,"plugin_search_passed":20,"plugin_seo_failures":0,"plugin_seo_passed":6,"plugin_form_builder_failures":0,"plugin_form_builder_passed":53,"plugin_multi_tenant_failures":0,"plugin_multi_tenant_passed":9,"build_ok":1,"modularity_penalty":2095,"largest_src_file_lines":1331,"operations_lines":1331,"relationships_lines":733,"src_file_count":14,"large_src_files":3,"plugin_suites_enabled":1,"duration_s":1780.417},"status":"keep","description":"Extract pagination calculation helper for modularity","timestamp":1779918414777,"segment":1,"confidence":171.66666666666666,"asi":{"hypothesis":"A behavior-preserving extraction of pagination calculation from operations.ts into a small utility should further reduce large-file concentration while preserving the current best conformance state.","result":"Primary blocker_failures matched the best at 15, with all green guardrails preserved. Architecture metrics improved: modularity_penalty 2111→2095 and operations_lines/largest_src_file_lines 1339→1331.","learned":"The pagination helper extraction is behavior-preserving when full-suite queue noise remains at the best observed level. Small coherent extractions are now viable tie-breaker wins while conformance is stable.","next_action_hint":"Continue reducing true blockers where possible: queues≈10, joins=3, uploads=2 local env. Additional modular extractions can be kept only when blocker_failures remains equal to best and guardrails stay green."}}
{"run":68,"commit":"aece53c","metric":15,"metrics":{"database_failures":0,"database_passed":153,"auth_failures":0,"auth_passed":66,"globals_failures":0,"globals_passed":13,"collections_rest_failures":0,"collections_rest_passed":112,"collections_graphql_failures":0,"collections_graphql_passed":47,"fields_failures":0,"fields_passed":157,"sort_failures":0,"sort_passed":37,"select_failures":0,"select_passed":115,"field_paths_failures":0,"field_paths_passed":2,"query_presets_failures":0,"query_presets_passed":11,"relationships_failures":0,"relationships_passed":57,"joins_failures":3,"joins_passed":71,"uploads_failures":2,"uploads_passed":100,"dataloader_failures":0,"dataloader_passed":4,"versions_failures":0,"versions_passed":98,"localization_failures":0,"localization_passed":117,"trash_failures":0,"trash_passed":97,"locked_documents_failures":0,"locked_documents_passed":13,"queues_failures":10,"queues_passed":62,"plugin_nested_docs_failures":0,"plugin_nested_docs_passed":11,"plugin_redirects_failures":0,"plugin_redirects_passed":3,"plugin_search_failures":0,"plugin_search_passed":20,"plugin_seo_failures":0,"plugin_seo_passed":6,"plugin_form_builder_failures":0,"plugin_form_builder_passed":53,"plugin_multi_tenant_failures":0,"plugin_multi_tenant_passed":9,"build_ok":1,"modularity_penalty":1961,"largest_src_file_lines":1264,"operations_lines":1264,"relationships_lines":733,"src_file_count":15,"large_src_files":3,"plugin_suites_enabled":1,"duration_s":1786.849},"status":"keep","description":"Extract sorting and comparison helpers for modularity","timestamp":1779920305565,"segment":1,"confidence":171.66666666666666,"asi":{"hypothesis":"A behavior-preserving extraction of sort parsing, SQL sort construction, and comparison helpers from operations.ts into a focused utility should improve module separation and reduce large-file concentration while preserving the current best conformance state.","result":"Primary blocker_failures matched the best at 15 with all green guardrails preserved. Architecture improved substantially: modularity_penalty 2095→1961 and operations_lines/largest_src_file_lines 1331→1264.","learned":"Sorting/comparison logic is separable from core CRUD operations without changing adapter semantics. This is a strong modularity tie-breaker win under equal conformance.","next_action_hint":"Continue true blocker work: queues around 10 failures, joins 3, uploads 2 local env. Further refactors should remain small and only keep when blocker_failures and guardrails remain equal."}}
{"run":69,"commit":"a3a71f9","metric":15,"metrics":{"database_failures":0,"database_passed":153,"auth_failures":0,"auth_passed":66,"globals_failures":0,"globals_passed":13,"collections_rest_failures":0,"collections_rest_passed":112,"collections_graphql_failures":0,"collections_graphql_passed":47,"fields_failures":0,"fields_passed":157,"sort_failures":0,"sort_passed":37,"select_failures":0,"select_passed":115,"field_paths_failures":0,"field_paths_passed":2,"query_presets_failures":0,"query_presets_passed":11,"relationships_failures":0,"relationships_passed":57,"joins_failures":3,"joins_passed":71,"uploads_failures":2,"uploads_passed":100,"dataloader_failures":0,"dataloader_passed":4,"versions_failures":0,"versions_passed":98,"localization_failures":0,"localization_passed":117,"trash_failures":0,"trash_passed":97,"locked_documents_failures":0,"locked_documents_passed":13,"queues_failures":10,"queues_passed":62,"plugin_nested_docs_failures":0,"plugin_nested_docs_passed":11,"plugin_redirects_failures":0,"plugin_redirects_passed":3,"plugin_search_failures":0,"plugin_search_passed":20,"plugin_seo_failures":0,"plugin_seo_passed":6,"plugin_form_builder_failures":0,"plugin_form_builder_passed":53,"plugin_multi_tenant_failures":0,"plugin_multi_tenant_passed":9,"build_ok":1,"modularity_penalty":1871,"largest_src_file_lines":1219,"operations_lines":1219,"relationships_lines":733,"src_file_count":16,"large_src_files":3,"plugin_suites_enabled":1,"duration_s":1816.304},"status":"keep","description":"Extract geospatial query helpers for modularity","timestamp":1779922206322,"segment":1,"confidence":187.27272727272728,"asi":{"hypothesis":"A behavior-preserving extraction of geospatial parsing/distance/polygon helpers from operations.ts into a focused utility should improve module separation and reduce large-file concentration while preserving the current best conformance state.","result":"Primary blocker_failures matched the best at 15 with all green guardrails preserved. Architecture improved: modularity_penalty 1961→1871 and operations_lines/largest_src_file_lines 1264→1219.","learned":"Geospatial client-side query logic is separable from core operations without changing semantics, continuing to reduce operations.ts concentration under equal conformance.","next_action_hint":"Continue with true blockers: queues≈10, joins=3, uploads=2 local env. Consider a small query predicate extraction next only if full conformance remains equal, or run targeted diagnostics for queue retry/cancel state."}}
{"run":70,"commit":"a3a71f9","metric":17,"metrics":{"database_failures":0,"database_passed":153,"auth_failures":0,"auth_passed":66,"globals_failures":0,"globals_passed":13,"collections_rest_failures":0,"collections_rest_passed":112,"collections_graphql_failures":0,"collections_graphql_passed":47,"fields_failures":0,"fields_passed":157,"sort_failures":0,"sort_passed":37,"select_failures":0,"select_passed":115,"field_paths_failures":0,"field_paths_passed":2,"query_presets_failures":0,"query_presets_passed":11,"relationships_failures":0,"relationships_passed":57,"joins_failures":3,"joins_passed":71,"uploads_failures":2,"uploads_passed":100,"dataloader_failures":0,"dataloader_passed":4,"versions_failures":0,"versions_passed":98,"localization_failures":0,"localization_passed":117,"trash_failures":0,"trash_passed":97,"locked_documents_failures":0,"locked_documents_passed":13,"queues_failures":12,"queues_passed":60,"plugin_nested_docs_failures":0,"plugin_nested_docs_passed":11,"plugin_redirects_failures":0,"plugin_redirects_passed":3,"plugin_search_failures":0,"plugin_search_passed":20,"plugin_seo_failures":0,"plugin_seo_passed":6,"plugin_form_builder_failures":0,"plugin_form_builder_passed":53,"plugin_multi_tenant_failures":0,"plugin_multi_tenant_passed":9,"build_ok":1,"modularity_penalty":1847,"largest_src_file_lines":1207,"operations_lines":1207,"relationships_lines":733,"src_file_count":17,"large_src_files":3,"plugin_suites_enabled":1,"duration_s":1820.289},"status":"discard","description":"Extract transaction visibility merge helper","timestamp":1779924086905,"segment":1,"confidence":206,"asi":{"hypothesis":"A behavior-preserving extraction of transaction visibility merging from operations.ts into a focused utility should improve module separation while preserving current conformance.","result":"Architecture metrics improved (modularity_penalty 1871→1847, operations_lines/largest_src_file_lines 1219→1207), but primary blocker_failures worsened from best 15 to 17 due to queues at 12 failures.","rollback_reason":"Conformance regression outweighs modularity improvement under the experiment rules. The extraction is likely behavior-preserving, but queue noise/regression means it cannot be kept now.","next_action_hint":"This extraction can be retried only when queues are equal to best. Prefer targeting true queue conformance issues or keep refactors only when blocker_failures remains 15."}}
{"run":71,"commit":"a909d03","metric":15,"metrics":{"database_failures":0,"database_passed":153,"auth_failures":0,"auth_passed":66,"globals_failures":0,"globals_passed":13,"collections_rest_failures":0,"collections_rest_passed":112,"collections_graphql_failures":0,"collections_graphql_passed":47,"fields_failures":0,"fields_passed":157,"sort_failures":0,"sort_passed":37,"select_failures":0,"select_passed":115,"field_paths_failures":0,"field_paths_passed":2,"query_presets_failures":0,"query_presets_passed":11,"relationships_failures":0,"relationships_passed":57,"joins_failures":3,"joins_passed":71,"uploads_failures":2,"uploads_passed":100,"dataloader_failures":0,"dataloader_passed":4,"versions_failures":0,"versions_passed":98,"localization_failures":0,"localization_passed":117,"trash_failures":0,"trash_passed":97,"locked_documents_failures":0,"locked_documents_passed":13,"queues_failures":10,"queues_passed":62,"plugin_nested_docs_failures":0,"plugin_nested_docs_passed":11,"plugin_redirects_failures":0,"plugin_redirects_passed":3,"plugin_search_failures":0,"plugin_search_passed":20,"plugin_seo_failures":0,"plugin_seo_passed":6,"plugin_form_builder_failures":0,"plugin_form_builder_passed":53,"plugin_multi_tenant_failures":0,"plugin_multi_tenant_passed":9,"build_ok":1,"modularity_penalty":1847,"largest_src_file_lines":1207,"operations_lines":1207,"relationships_lines":733,"src_file_count":17,"large_src_files":3,"plugin_suites_enabled":1,"duration_s":1820.842},"status":"keep","description":"Extract transaction visibility merge helper","timestamp":1779925973091,"segment":1,"confidence":228.88888888888889,"asi":{"hypothesis":"A behavior-preserving extraction of transaction visibility merging from operations.ts into a focused utility should improve module separation while preserving current conformance; the previous discard likely lost only to queue noise.","result":"Primary blocker_failures matched the best at 15, queues were at the best observed 10 failures, and all green guardrails stayed green. Architecture improved: modularity_penalty 1871→1847 and operations_lines/largest_src_file_lines 1219→1207.","learned":"Transaction visibility merging is separable from operations.ts without changing semantics. Retrying behavior-preserving refactors can be justified when prior discard was due to objective noise and the modularity gain is clear.","next_action_hint":"Continue reducing true blockers (queues≈10, joins=3, uploads=2 local env), or keep further small coherent extractions only when blocker_failures remains 15 and guardrails are unchanged."}}
{"run":72,"commit":"a909d03","metric":16,"metrics":{"database_failures":0,"database_passed":153,"auth_failures":0,"auth_passed":66,"globals_failures":0,"globals_passed":13,"collections_rest_failures":0,"collections_rest_passed":112,"collections_graphql_failures":0,"collections_graphql_passed":47,"fields_failures":0,"fields_passed":157,"sort_failures":0,"sort_passed":37,"select_failures":0,"select_passed":115,"field_paths_failures":0,"field_paths_passed":2,"query_presets_failures":0,"query_presets_passed":11,"relationships_failures":0,"relationships_passed":57,"joins_failures":3,"joins_passed":71,"uploads_failures":2,"uploads_passed":100,"dataloader_failures":0,"dataloader_passed":4,"versions_failures":0,"versions_passed":98,"localization_failures":0,"localization_passed":117,"trash_failures":0,"trash_passed":97,"locked_documents_failures":0,"locked_documents_passed":13,"queues_failures":11,"queues_passed":61,"plugin_nested_docs_failures":0,"plugin_nested_docs_passed":11,"plugin_redirects_failures":0,"plugin_redirects_passed":3,"plugin_search_failures":0,"plugin_search_passed":20,"plugin_seo_failures":0,"plugin_seo_passed":6,"plugin_form_builder_failures":0,"plugin_form_builder_passed":53,"plugin_multi_tenant_failures":0,"plugin_multi_tenant_passed":9,"build_ok":1,"modularity_penalty":1759,"largest_src_file_lines":1163,"operations_lines":1163,"relationships_lines":733,"src_file_count":18,"large_src_files":3,"plugin_suites_enabled":1,"duration_s":1649.502},"status":"discard","description":"Extract unique index validation helper","timestamp":1779927726949,"segment":1,"confidence":257.5,"asi":{"hypothesis":"A behavior-preserving extraction of unique index validation into a focused utility should improve module separation and reduce operations.ts size while preserving current conformance.","result":"Architecture metrics improved (modularity_penalty 1847→1759 and operations_lines/largest_src_file_lines 1207→1163), but primary blocker_failures worsened from best 15 to 16 due to queues at 11 failures.","rollback_reason":"Conformance regression outweighs modularity improvement. The extraction likely preserves behavior, but it cannot be kept when full objective failures are worse than best.","next_action_hint":"Retry this unique-index extraction only if the full sweep remains at blocker_failures=15. Otherwise target true queue failures or continue refactors cautiously with equal-conformance requirement."}}
{"run":73,"commit":"a909d03","metric":16,"metrics":{"database_failures":0,"database_passed":153,"auth_failures":0,"auth_passed":66,"globals_failures":0,"globals_passed":13,"collections_rest_failures":0,"collections_rest_passed":112,"collections_graphql_failures":0,"collections_graphql_passed":47,"fields_failures":0,"fields_passed":157,"sort_failures":0,"sort_passed":37,"select_failures":0,"select_passed":115,"field_paths_failures":0,"field_paths_passed":2,"query_presets_failures":0,"query_presets_passed":11,"relationships_failures":0,"relationships_passed":57,"joins_failures":3,"joins_passed":71,"uploads_failures":2,"uploads_passed":100,"dataloader_failures":0,"dataloader_passed":4,"versions_failures":0,"versions_passed":98,"localization_failures":0,"localization_passed":117,"trash_failures":0,"trash_passed":97,"locked_documents_failures":0,"locked_documents_passed":13,"queues_failures":11,"queues_passed":61,"plugin_nested_docs_failures":0,"plugin_nested_docs_passed":11,"plugin_redirects_failures":0,"plugin_redirects_passed":3,"plugin_search_failures":0,"plugin_search_passed":20,"plugin_seo_failures":0,"plugin_seo_passed":6,"plugin_form_builder_failures":0,"plugin_form_builder_passed":53,"plugin_multi_tenant_failures":0,"plugin_multi_tenant_passed":9,"build_ok":1,"modularity_penalty":1759,"largest_src_file_lines":1163,"operations_lines":1163,"relationships_lines":733,"src_file_count":18,"large_src_files":3,"plugin_suites_enabled":1,"duration_s":1644.572},"status":"discard","description":"Retry unique index validation extraction","timestamp":1779929469549,"segment":1,"confidence":294.2857142857143,"asi":{"hypothesis":"The previous unique-index extraction was likely behavior-preserving and lost only to queue noise; retrying should confirm whether it can be kept as an equal-conformance modularity improvement.","result":"Primary blocker_failures remained worse than best at 16, with queues at 11 failures. Architecture metrics improved but conformance did not match best.","rollback_reason":"Repeated full sweeps with this extraction are not hitting the equal-conformance tie-breaker; keeping it would violate the primary metric rule despite likely behavior preservation.","next_action_hint":"Do not retry unique-index extraction again unless queue noise is explicitly addressed. Shift to true queue blocker diagnostics/fixes or smaller refactors with less repeated queue-noise exposure."}}
