{"run":35,"commit":"f7e2d7a","metric":35,"metrics":{"database_failures":4,"database_passed":149,"auth_failures":0,"auth_passed":66,"globals_failures":0,"globals_passed":13,"collections_rest_failures":0,"collections_rest_passed":112,"collections_graphql_failures":1,"collections_graphql_passed":46,"fields_failures":0,"fields_passed":157,"sort_failures":0,"sort_passed":37,"select_failures":0,"select_passed":115,"field_paths_failures":0,"field_paths_passed":2,"query_presets_failures":0,"query_presets_passed":11,"relationships_failures":6,"relationships_passed":51,"joins_failures":5,"joins_passed":69,"uploads_failures":2,"uploads_passed":100,"dataloader_failures":0,"dataloader_passed":4,"versions_failures":0,"versions_passed":98,"localization_failures":0,"localization_passed":117,"trash_failures":0,"trash_passed":97,"locked_documents_failures":0,"locked_documents_passed":13,"queues_failures":11,"queues_passed":61,"plugin_nested_docs_failures":1,"plugin_nested_docs_passed":0,"plugin_redirects_failures":0,"plugin_redirects_passed":3,"plugin_search_failures":5,"plugin_search_passed":15,"plugin_seo_failures":0,"plugin_seo_passed":6,"plugin_form_builder_failures":0,"plugin_form_builder_passed":53,"plugin_multi_tenant_failures":0,"plugin_multi_tenant_passed":9,"build_ok":1,"modularity_penalty":2070,"largest_src_file_lines":1335,"operations_lines":1335,"relationships_lines":700,"src_file_count":12,"large_src_files":3,"plugin_suites_enabled":1,"duration_s":1425.951},"status":"keep","description":"Record transaction snapshots for queued updates","timestamp":1779856482597,"segment":2,"confidence":155.3846153846154,"asi":{"hypothesis":"Queued transaction updates returned updated docs to the caller but did not update the transaction read snapshot, so later same-transaction reads such as plugin-search beforeSync could see stale content after an update.","result":"blocker_failures improved from 37 to 35. plugin_search improved from 6 failures / 14 passed to 5 failures / 15 passed, and queues returned to 11 failures / 61 passed.","learned":"Read-your-writes requires both create and update paths to maintain transaction snapshots. Adding snapshots for queued updateOne paths fixes at least one plugin-search update synchronization failure without regressing core green suites.","next_action_hint":"Continue plugin_search remaining failures: reindex behavior still returns missing search docs for whole collection/localized/draft cases, and one published-with-new-draft delete expectation remains. Inspect plugin-search reindex endpoint and adapter find/update/delete behavior under localized/versioned docs."}}
{"run":36,"commit":"f7e2d7a","metric":37,"metrics":{"database_failures":4,"database_passed":149,"auth_failures":0,"auth_passed":66,"globals_failures":0,"globals_passed":13,"collections_rest_failures":0,"collections_rest_passed":112,"collections_graphql_failures":1,"collections_graphql_passed":46,"fields_failures":0,"fields_passed":157,"sort_failures":0,"sort_passed":37,"select_failures":0,"select_passed":115,"field_paths_failures":0,"field_paths_passed":2,"query_presets_failures":0,"query_presets_passed":11,"relationships_failures":6,"relationships_passed":51,"joins_failures":5,"joins_passed":69,"uploads_failures":2,"uploads_passed":100,"dataloader_failures":0,"dataloader_passed":4,"versions_failures":0,"versions_passed":98,"localization_failures":0,"localization_passed":117,"trash_failures":0,"trash_passed":97,"locked_documents_failures":0,"locked_documents_passed":13,"queues_failures":13,"queues_passed":59,"plugin_nested_docs_failures":1,"plugin_nested_docs_passed":0,"plugin_redirects_failures":0,"plugin_redirects_passed":3,"plugin_search_failures":5,"plugin_search_passed":15,"plugin_seo_failures":0,"plugin_seo_passed":6,"plugin_form_builder_failures":0,"plugin_form_builder_passed":53,"plugin_multi_tenant_failures":0,"plugin_multi_tenant_passed":9,"build_ok":1,"modularity_penalty":2070,"largest_src_file_lines":1335,"operations_lines":1335,"relationships_lines":700,"src_file_count":12,"large_src_files":3,"plugin_suites_enabled":1,"duration_s":1431.791},"status":"discard","description":"Use array intersect for hasMany contains equality","timestamp":1779858002775,"segment":2,"confidence":505,"asi":{"hypothesis":"The database hasMany select contains failure may be caused by Surreal array CONTAINS doing partial string matching, so using array::intersect for hasMany equals/contains should enforce exact membership.","rollback_reason":"Primary metric worsened from best 35 to 37. The database failure count did not improve, while queues regressed noisily from 11 to 13 failures.","next_action_hint":"Do not keep the broad hasMany contains rewrite. The failing select-hasMany contains case may have a different cause, possibly field config lookup or Surreal array semantics for select fields only. Prefer investigating with a targeted database-suite reproduction before retrying."}}
{"run":37,"commit":"f7e2d7a","metric":35,"metrics":{"database_failures":4,"database_passed":149,"auth_failures":0,"auth_passed":66,"globals_failures":0,"globals_passed":13,"collections_rest_failures":0,"collections_rest_passed":112,"collections_graphql_failures":1,"collections_graphql_passed":46,"fields_failures":0,"fields_passed":157,"sort_failures":0,"sort_passed":37,"select_failures":0,"select_passed":115,"field_paths_failures":0,"field_paths_passed":2,"query_presets_failures":0,"query_presets_passed":11,"relationships_failures":6,"relationships_passed":51,"joins_failures":5,"joins_passed":69,"uploads_failures":2,"uploads_passed":100,"dataloader_failures":0,"dataloader_passed":4,"versions_failures":0,"versions_passed":98,"localization_failures":0,"localization_passed":117,"trash_failures":0,"trash_passed":97,"locked_documents_failures":0,"locked_documents_passed":13,"queues_failures":11,"queues_passed":61,"plugin_nested_docs_failures":1,"plugin_nested_docs_passed":0,"plugin_redirects_failures":0,"plugin_redirects_passed":3,"plugin_search_failures":5,"plugin_search_passed":15,"plugin_seo_failures":0,"plugin_seo_passed":6,"plugin_form_builder_failures":0,"plugin_form_builder_passed":53,"plugin_multi_tenant_failures":0,"plugin_multi_tenant_passed":9,"build_ok":1,"modularity_penalty":2072,"largest_src_file_lines":1336,"operations_lines":1336,"relationships_lines":700,"src_file_count":12,"large_src_files":3,"plugin_suites_enabled":1,"duration_s":1445.942},"status":"discard","description":"Use transaction snapshot as existing doc for direct ID updates","timestamp":1779859559385,"segment":2,"confidence":505,"asi":{"hypothesis":"Plugin-search reindex creates a search doc and then updates it for additional locales within the same transaction. Direct update-by-id should use the transaction snapshot as the existing doc instead of falling back to an empty {id} shell when the doc has not committed yet.","rollback_reason":"Primary metric unchanged at 35 and no suite-level failure reduction. The added code also slightly worsened modularity metrics, so it is not worth keeping as a refactor tie-breaker.","next_action_hint":"The remaining plugin-search reindex failures are not fixed by direct-id update snapshots alone. Investigate whether transaction commit ordering, localized search doc updates, or reindex delete/create logic is losing search docs after commit."}}
{"run":38,"commit":"f7e2d7a","metric":36,"metrics":{"database_failures":4,"database_passed":149,"auth_failures":0,"auth_passed":66,"globals_failures":0,"globals_passed":13,"collections_rest_failures":0,"collections_rest_passed":112,"collections_graphql_failures":1,"collections_graphql_passed":46,"fields_failures":0,"fields_passed":157,"sort_failures":0,"sort_passed":37,"select_failures":0,"select_passed":115,"field_paths_failures":0,"field_paths_passed":2,"query_presets_failures":0,"query_presets_passed":11,"relationships_failures":6,"relationships_passed":51,"joins_failures":5,"joins_passed":69,"uploads_failures":2,"uploads_passed":100,"dataloader_failures":0,"dataloader_passed":4,"versions_failures":0,"versions_passed":98,"localization_failures":0,"localization_passed":117,"trash_failures":0,"trash_passed":97,"locked_documents_failures":0,"locked_documents_passed":13,"queues_failures":12,"queues_passed":60,"plugin_nested_docs_failures":1,"plugin_nested_docs_passed":0,"plugin_redirects_failures":0,"plugin_redirects_passed":3,"plugin_search_failures":5,"plugin_search_passed":15,"plugin_seo_failures":0,"plugin_seo_passed":6,"plugin_form_builder_failures":0,"plugin_form_builder_passed":53,"plugin_multi_tenant_failures":0,"plugin_multi_tenant_passed":9,"build_ok":1,"modularity_penalty":2070,"largest_src_file_lines":1335,"operations_lines":1335,"relationships_lines":700,"src_file_count":12,"large_src_files":3,"plugin_suites_enabled":1,"duration_s":1432.422},"status":"discard","description":"Use INSIDE for scalar hasMany contains filters","timestamp":1779861080688,"segment":2,"confidence":505,"asi":{"hypothesis":"Surreal's array CONTAINS semantics may not be exact for hasMany fields in generated WHERE clauses; using scalar INSIDE (array ?? []) for scalar contains/equals should avoid partial string matching while preserving array CONTAINSANY for list values.","rollback_reason":"Primary metric worsened from best 35 to 36 and database/relationships failures were unchanged. Queues regressed noisily by one failure, so this is not a keep.","next_action_hint":"Stop trying broad hasMany operator rewrites without targeted evidence. The database contains failure likely comes from field config/path handling rather than Surreal scalar membership syntax, or the suite result is masked by another database failure set."}}
{"run":39,"commit":"f7e2d7a","metric":36,"metrics":{"database_failures":4,"database_passed":149,"auth_failures":0,"auth_passed":66,"globals_failures":0,"globals_passed":13,"collections_rest_failures":0,"collections_rest_passed":112,"collections_graphql_failures":1,"collections_graphql_passed":46,"fields_failures":0,"fields_passed":157,"sort_failures":0,"sort_passed":37,"select_failures":0,"select_passed":115,"field_paths_failures":0,"field_paths_passed":2,"query_presets_failures":0,"query_presets_passed":11,"relationships_failures":6,"relationships_passed":51,"joins_failures":5,"joins_passed":69,"uploads_failures":2,"uploads_passed":100,"dataloader_failures":0,"dataloader_passed":4,"versions_failures":0,"versions_passed":98,"localization_failures":0,"localization_passed":117,"trash_failures":0,"trash_passed":97,"locked_documents_failures":0,"locked_documents_passed":13,"queues_failures":12,"queues_passed":60,"plugin_nested_docs_failures":1,"plugin_nested_docs_passed":0,"plugin_redirects_failures":0,"plugin_redirects_passed":3,"plugin_search_failures":5,"plugin_search_passed":15,"plugin_seo_failures":0,"plugin_seo_passed":6,"plugin_form_builder_failures":0,"plugin_form_builder_passed":53,"plugin_multi_tenant_failures":0,"plugin_multi_tenant_passed":9,"build_ok":1,"modularity_penalty":2042,"largest_src_file_lines":1321,"operations_lines":1321,"relationships_lines":700,"src_file_count":13,"large_src_files":3,"plugin_suites_enabled":1,"duration_s":1434.489},"status":"discard","description":"Extract pagination helpers from operations","timestamp":1779862648651,"segment":2,"confidence":1010,"asi":{"hypothesis":"A behavior-preserving extraction of pagination calculation/result shaping from operations.ts into a focused utility should improve modularity while preserving the same conformance state.","rollback_reason":"Although modularity_penalty improved from 2070 to 2042 and operations_lines dropped from 1335 to 1321, primary blocker_failures worsened from best 35 to 36 due to a queue failure count increase. Per objective rules, conformance regression wins over modularity, so discard.","next_action_hint":"The pagination extraction is likely behavior-preserving and may be worth retrying only if queue noise is confirmed, but do not keep it under a worse primary metric. Continue with functional fixes, preferably plugin-search or plugin-nested-docs."}}
{"run":40,"commit":"f7e2d7a","metric":36,"metrics":{"database_failures":4,"database_passed":149,"auth_failures":0,"auth_passed":66,"globals_failures":0,"globals_passed":13,"collections_rest_failures":0,"collections_rest_passed":112,"collections_graphql_failures":1,"collections_graphql_passed":46,"fields_failures":0,"fields_passed":157,"sort_failures":0,"sort_passed":37,"select_failures":0,"select_passed":115,"field_paths_failures":0,"field_paths_passed":2,"query_presets_failures":0,"query_presets_passed":11,"relationships_failures":6,"relationships_passed":51,"joins_failures":5,"joins_passed":69,"uploads_failures":2,"uploads_passed":100,"dataloader_failures":0,"dataloader_passed":4,"versions_failures":0,"versions_passed":98,"localization_failures":0,"localization_passed":117,"trash_failures":0,"trash_passed":97,"locked_documents_failures":0,"locked_documents_passed":13,"queues_failures":12,"queues_passed":60,"plugin_nested_docs_failures":1,"plugin_nested_docs_passed":0,"plugin_redirects_failures":0,"plugin_redirects_passed":3,"plugin_search_failures":5,"plugin_search_passed":15,"plugin_seo_failures":0,"plugin_seo_passed":6,"plugin_form_builder_failures":0,"plugin_form_builder_passed":53,"plugin_multi_tenant_failures":0,"plugin_multi_tenant_passed":9,"build_ok":1,"modularity_penalty":2042,"largest_src_file_lines":1321,"operations_lines":1321,"relationships_lines":700,"src_file_count":13,"large_src_files":3,"plugin_suites_enabled":1,"duration_s":1426.098},"status":"discard","description":"Retry pagination helper extraction for modularity confirmation","timestamp":1779864159210,"segment":2,"confidence":1010,"asi":{"hypothesis":"The previous pagination helper extraction likely preserved behavior and only lost to queue noise; rerunning the same modularity extraction should confirm whether it can meet the equal-conformance tie-breaker.","rollback_reason":"Primary metric again worsened from best 35 to 36 with queues at 12 failures, so it cannot be kept despite improved modularity. The repeated result suggests either queue noise is consistently unfavorable in these runs or the change subtly affects timing enough to expose an extra queue failure.","next_action_hint":"Do not retry pagination extraction again under the current objective. Continue with true functional fixes in plugin-search, plugin-nested-docs, relationships, or database virtual/contains behavior."}}
{"run":41,"commit":"f7e2d7a","metric":36,"metrics":{"database_failures":3,"database_passed":150,"auth_failures":0,"auth_passed":66,"globals_failures":0,"globals_passed":13,"collections_rest_failures":0,"collections_rest_passed":112,"collections_graphql_failures":1,"collections_graphql_passed":46,"fields_failures":3,"fields_passed":154,"sort_failures":0,"sort_passed":37,"select_failures":0,"select_passed":115,"field_paths_failures":0,"field_paths_passed":2,"query_presets_failures":0,"query_presets_passed":11,"relationships_failures":5,"relationships_passed":52,"joins_failures":5,"joins_passed":69,"uploads_failures":2,"uploads_passed":100,"dataloader_failures":0,"dataloader_passed":4,"versions_failures":0,"versions_passed":98,"localization_failures":0,"localization_passed":117,"trash_failures":0,"trash_passed":97,"locked_documents_failures":0,"locked_documents_passed":13,"queues_failures":11,"queues_passed":61,"plugin_nested_docs_failures":1,"plugin_nested_docs_passed":0,"plugin_redirects_failures":0,"plugin_redirects_passed":3,"plugin_search_failures":5,"plugin_search_passed":15,"plugin_seo_failures":0,"plugin_seo_passed":6,"plugin_form_builder_failures":0,"plugin_form_builder_passed":53,"plugin_multi_tenant_failures":0,"plugin_multi_tenant_passed":9,"build_ok":1,"modularity_penalty":2062,"largest_src_file_lines":1331,"operations_lines":1331,"relationships_lines":700,"src_file_count":12,"large_src_files":3,"plugin_suites_enabled":1,"duration_s":1437.577},"status":"discard","description":"Use exact array membership for client-side contains","timestamp":1779865804550,"segment":2,"confidence":1010,"asi":{"hypothesis":"The hasMany select and relationship contains failures are evaluated through client-side filtering because whereUsesVirtual routes hasMany fields through docMatchesWhere. Client-side contains should use exact array membership instead of substring matching for array values.","rollback_reason":"Primary metric worsened from best 35 to 36. Database improved by 1 and relationships improved by 1, but fields regressed from 0 to 3 failures, so the broad array exactness change breaks field contains semantics elsewhere.","next_action_hint":"Need schema-aware client-side contains: exact membership for hasMany select/relationship arrays, but preserve substring contains for text/richText-like array paths used by fields suite. Add field-aware operator handling rather than blanket Array exact matching."}}
{"run":42,"commit":"f7e2d7a","metric":35,"metrics":{"database_failures":3,"database_passed":150,"auth_failures":0,"auth_passed":66,"globals_failures":0,"globals_passed":13,"collections_rest_failures":0,"collections_rest_passed":112,"collections_graphql_failures":1,"collections_graphql_passed":46,"fields_failures":0,"fields_passed":157,"sort_failures":0,"sort_passed":37,"select_failures":0,"select_passed":115,"field_paths_failures":0,"field_paths_passed":2,"query_presets_failures":0,"query_presets_passed":11,"relationships_failures":5,"relationships_passed":52,"joins_failures":5,"joins_passed":69,"uploads_failures":2,"uploads_passed":100,"dataloader_failures":0,"dataloader_passed":4,"versions_failures":0,"versions_passed":98,"localization_failures":0,"localization_passed":117,"trash_failures":0,"trash_passed":97,"locked_documents_failures":0,"locked_documents_passed":13,"queues_failures":13,"queues_passed":59,"plugin_nested_docs_failures":1,"plugin_nested_docs_passed":0,"plugin_redirects_failures":0,"plugin_redirects_passed":3,"plugin_search_failures":5,"plugin_search_passed":15,"plugin_seo_failures":0,"plugin_seo_passed":6,"plugin_form_builder_failures":0,"plugin_form_builder_passed":53,"plugin_multi_tenant_failures":0,"plugin_multi_tenant_passed":9,"build_ok":1,"modularity_penalty":2086,"largest_src_file_lines":1343,"operations_lines":1343,"relationships_lines":700,"src_file_count":12,"large_src_files":3,"plugin_suites_enabled":1,"duration_s":1432.493},"status":"discard","description":"Use schema-aware exact contains for hasMany client filters","timestamp":1779867372351,"segment":2,"confidence":1010,"asi":{"hypothesis":"Client-side contains should be exact only for schema-known hasMany select/relationship/upload fields, preserving substring matching for field arrays that represent text-like paths.","rollback_reason":"Primary metric unchanged at 35, so no objective improvement. Database improved by 1 and relationships improved by 1 with fields preserved, but queue noise/regression from 11 to 13 offset the gains. Modularity also worsened, so no tie-breaker applies.","next_action_hint":"This change is semantically promising and may be worth combining with a queue stabilizer or rerunning once to distinguish noise, but do not keep it alone. It fixes the targeted database/relationship contains behavior without field regressions."}}
{"run":43,"commit":"56d99c5","metric":34,"metrics":{"database_failures":3,"database_passed":150,"auth_failures":0,"auth_passed":66,"globals_failures":0,"globals_passed":13,"collections_rest_failures":0,"collections_rest_passed":112,"collections_graphql_failures":1,"collections_graphql_passed":46,"fields_failures":0,"fields_passed":157,"sort_failures":0,"sort_passed":37,"select_failures":0,"select_passed":115,"field_paths_failures":0,"field_paths_passed":2,"query_presets_failures":0,"query_presets_passed":11,"relationships_failures":5,"relationships_passed":52,"joins_failures":5,"joins_passed":69,"uploads_failures":2,"uploads_passed":100,"dataloader_failures":0,"dataloader_passed":4,"versions_failures":0,"versions_passed":98,"localization_failures":0,"localization_passed":117,"trash_failures":0,"trash_passed":97,"locked_documents_failures":0,"locked_documents_passed":13,"queues_failures":12,"queues_passed":60,"plugin_nested_docs_failures":1,"plugin_nested_docs_passed":0,"plugin_redirects_failures":0,"plugin_redirects_passed":3,"plugin_search_failures":5,"plugin_search_passed":15,"plugin_seo_failures":0,"plugin_seo_passed":6,"plugin_form_builder_failures":0,"plugin_form_builder_passed":53,"plugin_multi_tenant_failures":0,"plugin_multi_tenant_passed":9,"build_ok":1,"modularity_penalty":2086,"largest_src_file_lines":1343,"operations_lines":1343,"relationships_lines":700,"src_file_count":12,"large_src_files":3,"plugin_suites_enabled":1,"duration_s":1442.75},"status":"keep","description":"Use schema-aware exact contains for hasMany client filters","timestamp":1779868971593,"segment":2,"confidence":1011,"asi":{"hypothesis":"Client-side contains should be exact only for schema-known hasMany select/relationship/upload fields, preserving substring matching for text-like fields. Prior run showed targeted database/relationship gains but was obscured by queue noise; rerun to confirm.","result":"blocker_failures improved from best 35 to 34. Database improved from 4 to 3 failures and relationships from 6 to 5, fields stayed green, while queues were one worse than best but less noisy than prior attempt.","learned":"Schema-aware client-side contains is a valid semantic fix. Broad exact array contains regressed fields, but restricting exactness to hasMany select/relationship/upload fields preserves field contains semantics and fixes two blocker tests.","next_action_hint":"Continue database/relationships: remaining failures include nested virtual/relationship querying and relationship sorting. Consider expanding schema-aware client filtering for deeper relationship paths or fixing virtual alias population."}}
