{"run":58,"commit":"307dc12","metric":16,"metrics":{"database_failures":0,"database_passed":153,"auth_failures":0,"auth_passed":66,"globals_failures":0,"globals_passed":13,"collections_rest_failures":0,"collections_rest_passed":112,"collections_graphql_failures":0,"collections_graphql_passed":47,"fields_failures":0,"fields_passed":157,"sort_failures":0,"sort_passed":37,"select_failures":0,"select_passed":115,"field_paths_failures":0,"field_paths_passed":2,"query_presets_failures":0,"query_presets_passed":11,"relationships_failures":0,"relationships_passed":57,"joins_failures":3,"joins_passed":71,"uploads_failures":2,"uploads_passed":100,"dataloader_failures":0,"dataloader_passed":4,"versions_failures":0,"versions_passed":98,"localization_failures":0,"localization_passed":117,"trash_failures":0,"trash_passed":97,"locked_documents_failures":0,"locked_documents_passed":13,"queues_failures":11,"queues_passed":61,"plugin_nested_docs_failures":0,"plugin_nested_docs_passed":11,"plugin_redirects_failures":0,"plugin_redirects_passed":3,"plugin_search_failures":0,"plugin_search_passed":20,"plugin_seo_failures":0,"plugin_seo_passed":6,"plugin_form_builder_failures":0,"plugin_form_builder_passed":53,"plugin_multi_tenant_failures":0,"plugin_multi_tenant_passed":9,"build_ok":1,"modularity_penalty":2233,"largest_src_file_lines":1400,"operations_lines":1400,"relationships_lines":733,"src_file_count":12,"large_src_files":3,"plugin_suites_enabled":1,"duration_s":1847.741},"status":"discard","description":"Serialize commits that update payload jobs","timestamp":1779901475532,"segment":1,"confidence":114.44444444444444,"asi":{"hypothesis":"Per-job update locks release after queuing a transaction statement, while the actual write happens during commit. Serializing commits that touch payload-jobs should reduce lost concurrent job log/retry updates without bypassing Payload's transaction boundary.","result":"Primary blocker_failures worsened from best 15 to 16. queues were 11 instead of the best 10, with joins and uploads unchanged.","rollback_reason":"Serializing payload-jobs commits did not improve queue failures and added complexity. The remaining queue blockers are not solved by commit-level serialization alone.","next_action_hint":"Avoid broader serialization. Target a concrete data-shape issue: atomic top-level log $push for parallel tasks, completedAt/null existence semantics, or supersedes delete rechecking against current processing state."}}
{"run":59,"commit":"307dc12","metric":40,"metrics":{"database_failures":0,"database_passed":153,"auth_failures":0,"auth_passed":66,"globals_failures":0,"globals_passed":13,"collections_rest_failures":0,"collections_rest_passed":112,"collections_graphql_failures":0,"collections_graphql_passed":47,"fields_failures":0,"fields_passed":157,"sort_failures":0,"sort_passed":37,"select_failures":0,"select_passed":115,"field_paths_failures":0,"field_paths_passed":2,"query_presets_failures":0,"query_presets_passed":11,"relationships_failures":0,"relationships_passed":57,"joins_failures":3,"joins_passed":71,"uploads_failures":2,"uploads_passed":100,"dataloader_failures":0,"dataloader_passed":4,"versions_failures":1,"versions_passed":97,"localization_failures":0,"localization_passed":117,"trash_failures":0,"trash_passed":97,"locked_documents_failures":0,"locked_documents_passed":13,"queues_failures":34,"queues_passed":38,"plugin_nested_docs_failures":0,"plugin_nested_docs_passed":11,"plugin_redirects_failures":0,"plugin_redirects_passed":3,"plugin_search_failures":0,"plugin_search_passed":20,"plugin_seo_failures":0,"plugin_seo_passed":6,"plugin_form_builder_failures":0,"plugin_form_builder_passed":53,"plugin_multi_tenant_failures":0,"plugin_multi_tenant_passed":9,"build_ok":1,"modularity_penalty":2245,"largest_src_file_lines":1406,"operations_lines":1406,"relationships_lines":733,"src_file_count":12,"large_src_files":3,"plugin_suites_enabled":1,"duration_s":1685.613},"status":"discard","description":"Use Surreal array concat for atomic job log pushes","timestamp":1779903251704,"segment":1,"confidence":121.17647058823529,"asi":{"hypothesis":"Parallel queue task failures lose log entries because top-level log $push updates are read-merge-write rather than atomic. Translating only log $push to Surreal array::concat should preserve concurrent append semantics while leaving broader $push behavior unchanged.","result":"Primary blocker_failures worsened badly from best 15 to 40. queues regressed to 34 failures and versions regressed by 1, while joins/uploads were unchanged.","rollback_reason":"Surreal array::concat atomic assignment is not compatible with the queue update path as implemented, likely because UPDATE returns malformed/null job docs or the expression syntax does not preserve full job shape. This repeats the earlier lesson that naive Surreal atomic append variants are unsafe.","next_action_hint":"Do not retry Surreal atomic log append without an isolated Surreal syntax probe and a targeted queue-only validation. Focus instead on non-atomic semantics: completedAt/null existence, retry waitUntil selection, or supersedes delete recheck."}}
{"run":60,"commit":"307dc12","metric":17,"metrics":{"database_failures":0,"database_passed":153,"auth_failures":0,"auth_passed":66,"globals_failures":0,"globals_passed":13,"collections_rest_failures":0,"collections_rest_passed":112,"collections_graphql_failures":0,"collections_graphql_passed":47,"fields_failures":0,"fields_passed":157,"sort_failures":0,"sort_passed":37,"select_failures":0,"select_passed":115,"field_paths_failures":0,"field_paths_passed":2,"query_presets_failures":0,"query_presets_passed":11,"relationships_failures":0,"relationships_passed":57,"joins_failures":3,"joins_passed":71,"uploads_failures":2,"uploads_passed":100,"dataloader_failures":0,"dataloader_passed":4,"versions_failures":0,"versions_passed":98,"localization_failures":0,"localization_passed":117,"trash_failures":0,"trash_passed":97,"locked_documents_failures":0,"locked_documents_passed":13,"queues_failures":12,"queues_passed":60,"plugin_nested_docs_failures":0,"plugin_nested_docs_passed":11,"plugin_redirects_failures":0,"plugin_redirects_passed":3,"plugin_search_failures":0,"plugin_search_passed":20,"plugin_seo_failures":0,"plugin_seo_passed":6,"plugin_form_builder_failures":0,"plugin_form_builder_passed":53,"plugin_multi_tenant_failures":0,"plugin_multi_tenant_passed":9,"build_ok":1,"modularity_penalty":2111,"largest_src_file_lines":1339,"operations_lines":1339,"relationships_lines":733,"src_file_count":13,"large_src_files":3,"plugin_suites_enabled":1,"duration_s":1790.596},"status":"discard","description":"Extract atomic update path helpers","timestamp":1779905129529,"segment":1,"confidence":114.44444444444444,"asi":{"hypothesis":"With queue functional fixes plateauing, a behavior-preserving extraction of atomic update path helpers from operations.ts into a focused utility should improve modularity without changing conformance.","result":"Architecture metrics improved substantially (modularity_penalty 2233→2111, operations_lines 1400→1339, largest_src_file_lines 1400→1339), but primary blocker_failures worsened from best 15 to 17 due to queues at 12 failures.","rollback_reason":"Per experiment rules, conformance regression outweighs modularity improvement. The extraction appears behavior-preserving but cannot be kept while the full sweep is worse than the current best.","next_action_hint":"This extraction is a good refactor candidate to retry only when queue noise is equal to best or after queue failures are stabilized. Continue with targeted queue semantics, especially completedAt/null existence or supersedes processing visibility."}}
{"run":61,"commit":"307dc12","metric":17,"metrics":{"database_failures":0,"database_passed":153,"auth_failures":0,"auth_passed":66,"globals_failures":0,"globals_passed":13,"collections_rest_failures":0,"collections_rest_passed":112,"collections_graphql_failures":0,"collections_graphql_passed":47,"fields_failures":0,"fields_passed":157,"sort_failures":0,"sort_passed":37,"select_failures":0,"select_passed":115,"field_paths_failures":0,"field_paths_passed":2,"query_presets_failures":0,"query_presets_passed":11,"relationships_failures":0,"relationships_passed":57,"joins_failures":3,"joins_passed":71,"uploads_failures":2,"uploads_passed":100,"dataloader_failures":0,"dataloader_passed":4,"versions_failures":0,"versions_passed":98,"localization_failures":0,"localization_passed":117,"trash_failures":0,"trash_passed":97,"locked_documents_failures":0,"locked_documents_passed":13,"queues_failures":12,"queues_passed":60,"plugin_nested_docs_failures":0,"plugin_nested_docs_passed":11,"plugin_redirects_failures":0,"plugin_redirects_passed":3,"plugin_search_failures":0,"plugin_search_passed":20,"plugin_seo_failures":0,"plugin_seo_passed":6,"plugin_form_builder_failures":0,"plugin_form_builder_passed":53,"plugin_multi_tenant_failures":0,"plugin_multi_tenant_passed":9,"build_ok":1,"modularity_penalty":2247,"largest_src_file_lines":1407,"operations_lines":1407,"relationships_lines":733,"src_file_count":12,"large_src_files":3,"plugin_suites_enabled":1,"duration_s":1854.686},"status":"discard","description":"Add deterministic id tie-breaker to SQL sorting","timestamp":1779907060762,"segment":1,"confidence":114.44444444444444,"asi":{"hypothesis":"The remaining LIFO queue failure may come from equal or near-equal createdAt values being sorted nondeterministically. Adding an id tie-breaker in the same direction as createdAt should make FIFO/LIFO queue selection deterministic without changing primary sort semantics except on ties.","result":"Primary blocker_failures worsened from best 15 to 17. queues were 12, joins and uploads unchanged.","rollback_reason":"The deterministic id tie-breaker did not improve queue ordering failures and increased operations.ts size/modularity penalty. LIFO/concurrency failures are likely not caused by SQL tie ordering alone.","next_action_hint":"Do not retry generic SQL tie-breakers. Focus queue retry/cancellation state persistence or targeted supersedes processing visibility. Consider targeted queue-only diagnostics before the next full sweep to avoid noisy broad hypotheses."}}
{"run":62,"commit":"307dc12","metric":25,"metrics":{"database_failures":0,"database_passed":153,"auth_failures":0,"auth_passed":66,"globals_failures":0,"globals_passed":13,"collections_rest_failures":0,"collections_rest_passed":112,"collections_graphql_failures":0,"collections_graphql_passed":47,"fields_failures":3,"fields_passed":154,"sort_failures":0,"sort_passed":37,"select_failures":0,"select_passed":115,"field_paths_failures":0,"field_paths_passed":2,"query_presets_failures":0,"query_presets_passed":11,"relationships_failures":0,"relationships_passed":57,"joins_failures":3,"joins_passed":71,"uploads_failures":2,"uploads_passed":100,"dataloader_failures":0,"dataloader_passed":4,"versions_failures":0,"versions_passed":98,"localization_failures":0,"localization_passed":117,"trash_failures":6,"trash_passed":91,"locked_documents_failures":0,"locked_documents_passed":13,"queues_failures":11,"queues_passed":61,"plugin_nested_docs_failures":0,"plugin_nested_docs_passed":11,"plugin_redirects_failures":0,"plugin_redirects_passed":3,"plugin_search_failures":0,"plugin_search_passed":20,"plugin_seo_failures":0,"plugin_seo_passed":6,"plugin_form_builder_failures":0,"plugin_form_builder_passed":53,"plugin_multi_tenant_failures":0,"plugin_multi_tenant_passed":9,"build_ok":1,"modularity_penalty":2233,"largest_src_file_lines":1400,"operations_lines":1400,"relationships_lines":733,"src_file_count":12,"large_src_files":3,"plugin_suites_enabled":1,"duration_s":1827.899},"status":"discard","description":"Use Surreal IS NONE for exists filters","timestamp":1779908957213,"segment":1,"confidence":114.44444444444444,"asi":{"hypothesis":"Queue runnable and supersedes predicates rely heavily on exists:false for completedAt/concurrencyKey. Surreal's IS NONE syntax might more accurately match missing or null fields than equality against NONE/NULL.","result":"Primary blocker_failures worsened badly from best 15 to 25. fields regressed by 3 and trash regressed by 6; queues stayed worse than best at 11 failures.","rollback_reason":"IS NONE semantics are not equivalent to Payload exists:false/null expectations across the full suite. This regressed green guardrails and did not improve queues.","next_action_hint":"Do not change global exists operator semantics. If completedAt/null remains suspicious, handle payload-jobs specifically in queue selection or inspect Surreal rows directly instead of altering all exists filters."}}
{"run":63,"commit":"307dc12","metric":16,"metrics":{"database_failures":0,"database_passed":153,"auth_failures":0,"auth_passed":66,"globals_failures":0,"globals_passed":13,"collections_rest_failures":0,"collections_rest_passed":112,"collections_graphql_failures":0,"collections_graphql_passed":47,"fields_failures":0,"fields_passed":157,"sort_failures":0,"sort_passed":37,"select_failures":0,"select_passed":115,"field_paths_failures":0,"field_paths_passed":2,"query_presets_failures":0,"query_presets_passed":11,"relationships_failures":0,"relationships_passed":57,"joins_failures":3,"joins_passed":71,"uploads_failures":2,"uploads_passed":100,"dataloader_failures":0,"dataloader_passed":4,"versions_failures":0,"versions_passed":98,"localization_failures":0,"localization_passed":117,"trash_failures":0,"trash_passed":97,"locked_documents_failures":0,"locked_documents_passed":13,"queues_failures":11,"queues_passed":61,"plugin_nested_docs_failures":0,"plugin_nested_docs_passed":11,"plugin_redirects_failures":0,"plugin_redirects_passed":3,"plugin_search_failures":0,"plugin_search_passed":20,"plugin_seo_failures":0,"plugin_seo_passed":6,"plugin_form_builder_failures":0,"plugin_form_builder_passed":53,"plugin_multi_tenant_failures":0,"plugin_multi_tenant_passed":9,"build_ok":1,"modularity_penalty":2271,"largest_src_file_lines":1419,"operations_lines":1419,"relationships_lines":733,"src_file_count":12,"large_src_files":3,"plugin_suites_enabled":1,"duration_s":1936.856},"status":"discard","description":"Track in-process job processing state for supersedes deletes","timestamp":1779910985621,"segment":1,"confidence":114.44444444444444,"asi":{"hypothesis":"Supersedes failures delete jobs that have been marked processing by the local worker but whose DB update may not be visible to the queueing delete yet. Tracking in-process payload job IDs when processing is set true and excluding them from payload-jobs deleteMany should preserve running jobs without changing non-job deletes.","result":"Primary blocker_failures worsened from best 15 to 16. queues remained worse than best at 11 failures and joins/uploads were unchanged.","rollback_reason":"In-process processing tracking plus client-side payload-jobs deleteMany did not reduce supersedes failures and worsened modularity/operations size. The running-job deletion issue is not solved by this local marker alone, or other queue noise offsets it.","next_action_hint":"Do not keep local processing registry. Need targeted diagnostics for supersedes to inspect the actual processing value and delete predicate timing, or shift back to retry/backoff/cancellation persistence."}}
{"run":64,"commit":"307dc12","metric":16,"metrics":{"database_failures":0,"database_passed":153,"auth_failures":0,"auth_passed":66,"globals_failures":0,"globals_passed":13,"collections_rest_failures":0,"collections_rest_passed":112,"collections_graphql_failures":0,"collections_graphql_passed":47,"fields_failures":0,"fields_passed":157,"sort_failures":0,"sort_passed":37,"select_failures":0,"select_passed":115,"field_paths_failures":0,"field_paths_passed":2,"query_presets_failures":0,"query_presets_passed":11,"relationships_failures":0,"relationships_passed":57,"joins_failures":3,"joins_passed":71,"uploads_failures":2,"uploads_passed":100,"dataloader_failures":0,"dataloader_passed":4,"versions_failures":0,"versions_passed":98,"localization_failures":0,"localization_passed":117,"trash_failures":0,"trash_passed":97,"locked_documents_failures":0,"locked_documents_passed":13,"queues_failures":11,"queues_passed":61,"plugin_nested_docs_failures":0,"plugin_nested_docs_passed":11,"plugin_redirects_failures":0,"plugin_redirects_passed":3,"plugin_search_failures":0,"plugin_search_passed":20,"plugin_seo_failures":0,"plugin_seo_passed":6,"plugin_form_builder_failures":0,"plugin_form_builder_passed":53,"plugin_multi_tenant_failures":0,"plugin_multi_tenant_passed":9,"build_ok":1,"modularity_penalty":2232,"largest_src_file_lines":1400,"operations_lines":1400,"relationships_lines":732,"src_file_count":12,"large_src_files":3,"plugin_suites_enabled":1,"duration_s":1779.186},"status":"discard","description":"Disable localized join fallback to first available locale","timestamp":1779912845313,"segment":1,"confidence":114.44444444444444,"asi":{"hypothesis":"Remaining localized join failures may be caused by localized relationship wrappers falling back to the first available locale when the requested/default locale is absent. For join membership, default-locale requests should not include es-only relationships, and es requests should not fall back to en relationships.","result":"Primary blocker_failures worsened from best 15 to 16. joins remained at 3 failures and queues were 11, so the targeted localized join failures did not improve in the full sweep.","rollback_reason":"Removing first-locale fallback in join wrapper resolution did not reduce joins and left primary metric worse due to queue count. The localized failures likely involve earlier target doc read transforms or Payload locale fallback behavior rather than this wrapper fallback alone.","next_action_hint":"Stop localized join fallback tweaks without targeted instrumentation. Queue blockers remain largest; if continuing joins, inspect actual joined doc IDs/titles for the two localized failures before changing resolution again."}}
{"run":65,"commit":"307dc12","metric":16,"metrics":{"database_failures":0,"database_passed":153,"auth_failures":0,"auth_passed":66,"globals_failures":0,"globals_passed":13,"collections_rest_failures":0,"collections_rest_passed":112,"collections_graphql_failures":0,"collections_graphql_passed":47,"fields_failures":0,"fields_passed":157,"sort_failures":0,"sort_passed":37,"select_failures":0,"select_passed":115,"field_paths_failures":0,"field_paths_passed":2,"query_presets_failures":0,"query_presets_passed":11,"relationships_failures":0,"relationships_passed":57,"joins_failures":3,"joins_passed":71,"uploads_failures":2,"uploads_passed":100,"dataloader_failures":0,"dataloader_passed":4,"versions_failures":0,"versions_passed":98,"localization_failures":0,"localization_passed":117,"trash_failures":0,"trash_passed":97,"locked_documents_failures":0,"locked_documents_passed":13,"queues_failures":11,"queues_passed":61,"plugin_nested_docs_failures":0,"plugin_nested_docs_passed":11,"plugin_redirects_failures":0,"plugin_redirects_passed":3,"plugin_search_failures":0,"plugin_search_passed":20,"plugin_seo_failures":0,"plugin_seo_passed":6,"plugin_form_builder_failures":0,"plugin_form_builder_passed":53,"plugin_multi_tenant_failures":0,"plugin_multi_tenant_passed":9,"build_ok":1,"modularity_penalty":2233,"largest_src_file_lines":1400,"operations_lines":1400,"relationships_lines":733,"src_file_count":12,"large_src_files":3,"plugin_suites_enabled":1,"duration_s":1808.463},"status":"discard","description":"Pass locale into nested join target population","timestamp":1779914715126,"segment":1,"confidence":147.14285714285714,"asi":{"hypothesis":"Remaining localized join failures may come from joined target docs being recursively populated/read-transformed without the request locale, so nested join target population should receive the same locale used for the parent join.","result":"Primary blocker_failures worsened from best 15 to 16. joins remained at 3 failures and queues were 11, so no objective improvement.","rollback_reason":"Passing locale into nested target population did not change the remaining join failures. The localized failures likely concern membership resolution or Payload locale fallback before target population, not nested read transforms.","next_action_hint":"Avoid more blind localized join changes. Queue failures remain the larger target; for joins, add targeted diagnostics outside full sweep to inspect raw categoriesLocalized storage and join membership IDs."}}
