{"run":21,"commit":"8a91605","metric":29,"metrics":{"query_presets_failures":0,"query_presets_passed":11,"trash_failures":0,"trash_passed":97,"uploads_failures":2,"uploads_passed":100,"joins_failures":15,"joins_passed":59,"queues_failures":12,"queues_passed":60,"build_ok":1,"duration_s":1294.317},"status":"discard","description":"Traverse join pagination docs in getValueAtPath","timestamp":1779750342215,"segment":1,"confidence":451.45454545454544,"asi":{"hypothesis":"Top-level where-by-join failures might come from docMatchesWhere/getValueAtPath not traversing join pagination objects like {docs:[...]} for paths such as relatedPosts.title or relatedPosts equals postID.","rollback_reason":"Primary metric unchanged at 29. The added traversal did not reduce join failures, so top-level where-by-join timeouts are likely elsewhere (possibly whereUsesVirtual forcing too much work or join predicates not being converted to target-parent filters).","next_action_hint":"Implement a true join-aware parent prefilter: detect where roots that are join fields, query target collections using the suffix predicate plus join.on relationship back to parent, then filter parent docs by matching IDs. Avoid relying solely on populated docs traversal."}}
{"run":22,"commit":"a134a2d","metric":22,"metrics":{"query_presets_failures":0,"query_presets_passed":11,"trash_failures":0,"trash_passed":97,"uploads_failures":2,"uploads_passed":100,"joins_failures":8,"joins_passed":66,"queues_failures":12,"queues_passed":60,"build_ok":1,"duration_s":597.602},"status":"keep","description":"Make join-aware client filtering traverse pagination docs at shallow depth","timestamp":1779751004848,"segment":1,"confidence":473.6190476190476,"asi":{"hypothesis":"Top-level where-by-join failures require both shallow join population to avoid recursive work and getValueAtPath traversal through join pagination objects; each alone was insufficient, but together should let docMatchesWhere evaluate populated joins quickly.","result":"joins improved from 15 failed / 59 passed to 8 failed / 66 passed; full blocker metric improved from 29 to 22 and runtime dropped from ~1298s to ~598s.","learned":"Client-side virtual handling for join predicates needs only depth 1 and must treat {docs:[...]} as the traversable value. Deep population caused timeouts; plain traversal without shallow depth did not fix them.","next_action_hint":"Continue with remaining 8 joins and 12 queues. Inspect remaining joins list; likely localized/versioned joins and collection-array sort/filter remain after top-level where-by-join improvements."}}
{"run":23,"commit":"a134a2d","metric":22,"metrics":{"query_presets_failures":0,"query_presets_passed":11,"trash_failures":0,"trash_passed":97,"uploads_failures":2,"uploads_passed":100,"joins_failures":8,"joins_passed":66,"queues_failures":12,"queues_passed":60,"build_ok":1,"duration_s":613.184},"status":"discard","description":"Preserve requested join sort separately from default sort","timestamp":1779751662853,"segment":1,"confidence":497.3,"asi":{"hypothesis":"Collection-array join sort failure might be caused by losing whether sort was explicitly requested versus defaulted, so preserving requestedSort could avoid collection fallback ordering overriding explicit sort.","rollback_reason":"Primary metric unchanged at 22; no objective failure reduction.","next_action_hint":"Collection-array sort failure remains. Need inspect actual sort path and field.collection array result sorting, not just requested/default sort distinction."}}
{"run":24,"commit":"a134a2d","metric":22,"metrics":{"query_presets_failures":0,"query_presets_passed":11,"trash_failures":0,"trash_passed":97,"uploads_failures":2,"uploads_passed":100,"joins_failures":9,"joins_passed":65,"queues_failures":11,"queues_passed":61,"build_ok":1,"duration_s":657.267},"status":"discard","description":"Traverse localized wrappers in join target path resolution","timestamp":1779752404235,"segment":1,"confidence":523.4736842105264,"asi":{"hypothesis":"Localized array join failures were caused by relationship getValueAtPath not traversing localized wrapper objects like { en: [{ category }] } when resolving join.on paths such as localizedArray.category.","rollback_reason":"Primary metric unchanged at 22. Joins improved by one, but queues improved/noise and joins regressed relative to best 8; no full-rubric improvement.","next_action_hint":"The localized wrapper traversal is directionally useful but not sufficient under the current aggregate metric. Reconsider later with another complementary joins fix, or run targeted joins-only validation before reapplying."}}
{"run":25,"commit":"d708c82","metric":19,"metrics":{"query_presets_failures":0,"query_presets_passed":11,"trash_failures":0,"trash_passed":97,"uploads_failures":2,"uploads_passed":100,"joins_failures":5,"joins_passed":69,"queues_failures":12,"queues_passed":60,"build_ok":1,"duration_s":586.27},"status":"keep","description":"Populate joins after materializing draft query results","timestamp":1779753107557,"segment":1,"confidence":552.8888888888889,"asi":{"hypothesis":"Draft query results are materialized from version.version after the version table read, so join fields on the base collection can be missing unless transformRelationshipReads is applied again to the materialized draft docs.","result":"Full blocker metric improved from 22 to 19. Joins improved from 8 failures / 66 passed to 5 failures / 69 passed; green guardrails stayed green and queues were unchanged.","learned":"The version-table transform path was not sufficient for draft query joins. Explicitly populating relationships/joins on the materialized base draft documents fixes draft join cases without special-casing tests.","next_action_hint":"Remaining joins are likely localized relationship joins, GraphQL group pagination, and multi-collection sort/filter. Inspect latest joins log before selecting next fix."}}
{"run":26,"commit":"d708c82","metric":19,"metrics":{"query_presets_failures":0,"query_presets_passed":11,"trash_failures":0,"trash_passed":97,"uploads_failures":2,"uploads_passed":100,"joins_failures":5,"joins_passed":69,"queues_failures":12,"queues_passed":60,"build_ok":1,"duration_s":577.184},"status":"discard","description":"Support nested object join options lookup after draft join fixes","timestamp":1779753732798,"segment":1,"confidence":452.3636363636364,"asi":{"hypothesis":"Remaining GraphQL group join pagination might be caused by sanitized joins sometimes being passed as nested objects instead of dot-path keys, so resolving join options by walking path segments should restore nested limit/page/sort.","rollback_reason":"Primary metric unchanged at 19; no objective reduction in remaining blocker failures.","next_action_hint":"GraphQL group pagination failure is not fixed by nested join option lookup. Inspect actual joins shape or afterRead/GraphQL layer interaction before retrying. Remaining objective wins may be easier in queues retry/cancel/updateJobs semantics."}}
{"run":27,"commit":"d708c82","metric":19,"metrics":{"query_presets_failures":0,"query_presets_passed":11,"trash_failures":0,"trash_passed":97,"uploads_failures":2,"uploads_passed":100,"joins_failures":5,"joins_passed":69,"queues_failures":12,"queues_passed":60,"build_ok":1,"duration_s":565.093},"status":"discard","description":"Pass request locale into join value resolution","timestamp":1779754422352,"segment":1,"confidence":382.7692307692308,"asi":{"hypothesis":"Remaining localized join failures may be caused by resolving localized relationship wrapper objects without the request locale, so passing args.locale into join population and flattenJoinValues should filter relationship IDs to the active locale.","rollback_reason":"Primary metric unchanged at 19 and localized join failure count did not improve in the full objective sweep.","next_action_hint":"Localized failures are not solved by simply passing locale into flattenJoinValues. Investigate Payload afterRead locale behavior for target docs and localized relationship sort/filter semantics, or switch focus to queue retry/cancel semantics for larger remaining objective wins."}}
{"run":28,"commit":"d708c82","metric":19,"metrics":{"query_presets_failures":0,"query_presets_passed":11,"trash_failures":0,"trash_passed":97,"uploads_failures":2,"uploads_passed":100,"joins_failures":6,"joins_passed":68,"queues_failures":11,"queues_passed":61,"build_ok":1,"duration_s":568.409},"status":"discard","description":"Traverse localized wrappers in join path resolution after draft fixes","timestamp":1779755026202,"segment":1,"confidence":414.6666666666667,"asi":{"hypothesis":"Remaining localized array join failures may be caused by relationship join path resolution not traversing localized wrapper objects like { en: [{ category }] } for join.on paths.","rollback_reason":"Primary metric unchanged at 19. The run traded one fewer queue failure/noise for one additional joins failure versus best, so no objective improvement under the full 1.0 rubric.","next_action_hint":"Localized wrapper traversal remains insufficient and can regress joins. Shift focus to queue retry/cancel/updateJobs semantics or inspect exact remaining join data shape before another localized join attempt."}}
{"run":29,"commit":"4f0420c","metric":18,"metrics":{"query_presets_failures":0,"query_presets_passed":11,"trash_failures":0,"trash_passed":97,"uploads_failures":2,"uploads_passed":100,"joins_failures":5,"joins_passed":69,"queues_failures":11,"queues_passed":61,"build_ok":1,"duration_s":566.647},"status":"keep","description":"Serialize same-job updates to avoid queue state races","timestamp":1779755687962,"segment":1,"confidence":452.45454545454544,"asi":{"hypothesis":"Several queue failures, especially parallel-task and cancellation/retry state transitions, may be caused by concurrent read-merge-write updates to the same payload-jobs document losing fields. Serializing same-job updates in-process should preserve Mongo-like document update semantics for the local queue runner without changing Payload tests.","result":"Full blocker metric improved from 19 to 18. Queues improved from 12 failures / 60 passed to 11 failures / 61 passed while joins and green guardrails stayed unchanged.","learned":"At least one remaining queue blocker is sensitive to same-job update races; a narrow per-job update lock is safer than the previous Surreal atomic append attempt and preserved existing suites.","next_action_hint":"Inspect current queue failure list to see which race-sensitive test turned green. Continue with queue semantics: retry count/backoff/cancel/supersedes remain, and a more complete transactional compare/update or targeted updateJobs claim behavior may reduce more failures."}}
{"run":30,"commit":"4f0420c","metric":19,"metrics":{"query_presets_failures":0,"query_presets_passed":11,"trash_failures":0,"trash_passed":97,"uploads_failures":2,"uploads_passed":100,"joins_failures":5,"joins_passed":69,"queues_failures":12,"queues_passed":60,"build_ok":1,"duration_s":573.292},"status":"discard","description":"Serialize conditional payload job deletions with job update locks","timestamp":1779756343093,"segment":1,"confidence":474,"asi":{"hypothesis":"Supersedes queue failures may be caused by payload_jobs deleteMany racing with runJobs marking a job as processing; serializing conditional job deletions with the same per-job lock and rechecking the where clause should avoid deleting newly-running jobs.","rollback_reason":"Primary metric worsened from best 18 to 19; queues regressed from 11 to 12 failures.","next_action_hint":"Do not keep broad locked deleteMany path. The supersedes/running race hypothesis was not validated in the full sweep. Continue with more targeted queue retry/backoff/updateJobs semantics or inspect exact current queue failure diff after the kept per-job update lock."}}
{"run":31,"commit":"4f0420c","metric":18,"metrics":{"query_presets_failures":0,"query_presets_passed":11,"trash_failures":0,"trash_passed":97,"uploads_failures":2,"uploads_passed":100,"joins_failures":5,"joins_passed":69,"queues_failures":11,"queues_passed":61,"build_ok":1,"duration_s":565.053},"status":"discard","description":"Default localized join flattening to default locale","timestamp":1779757008044,"segment":1,"confidence":452.45454545454544,"asi":{"hypothesis":"Localized join failures may occur because default-locale requests pass no explicit locale into adapter join population, causing flattenJoinValues to scan all locale wrappers and include es-only relationships in en results. Defaulting join flattening to Payload's defaultLocale should filter localized relationship IDs unless a request locale overrides it.","rollback_reason":"Primary metric unchanged at 18; no objective failure reduction over the current best.","next_action_hint":"Default-locale flattening alone is not enough. Remaining localized failures likely involve target doc locale read transforms or localized join.on path resolution. Consider queue retry/backoff semantics next because the joins attempts are plateauing."}}
{"type":"config","name":"Payload SurrealDB full 1.0 readiness and modularity","metricName":"blocker_failures","metricUnit":"","bestDirection":"lower"}
{"run":32,"commit":"e3edd6a","metric":1045,"metrics":{"database_failures":4,"database_passed":149,"auth_failures":0,"auth_passed":66,"globals_failures":0,"globals_passed":13,"collections_rest_failures":0,"collections_rest_passed":112,"collections_graphql_failures":1,"collections_graphql_passed":46,"fields_failures":0,"fields_passed":157,"sort_failures":0,"sort_passed":37,"select_failures":0,"select_passed":115,"field_paths_failures":0,"field_paths_passed":2,"query_presets_failures":0,"query_presets_passed":11,"relationships_failures":6,"relationships_passed":51,"joins_failures":5,"joins_passed":69,"uploads_failures":2,"uploads_passed":100,"dataloader_failures":0,"dataloader_passed":4,"versions_failures":0,"versions_passed":98,"localization_failures":0,"localization_passed":117,"trash_failures":0,"trash_passed":97,"locked_documents_failures":0,"locked_documents_passed":13,"queues_failures":11,"queues_passed":61,"plugin_nested_docs_failures":999,"plugin_nested_docs_passed":0,"plugin_redirects_failures":0,"plugin_redirects_passed":3,"plugin_search_failures":17,"plugin_search_passed":3,"plugin_seo_failures":0,"plugin_seo_passed":6,"plugin_form_builder_failures":0,"plugin_form_builder_passed":53,"plugin_multi_tenant_failures":0,"plugin_multi_tenant_passed":9,"build_ok":1,"modularity_penalty":2052,"largest_src_file_lines":1326,"operations_lines":1326,"relationships_lines":700,"src_file_count":12,"large_src_files":3,"plugin_suites_enabled":1,"duration_s":1519.601},"status":"keep","description":"Baseline for expanded full 1.0 readiness objective with modularity metrics","timestamp":1779851958379,"segment":2,"confidence":null,"asi":{"hypothesis":"Broaden autoresearch to the full ROADMAP-1.0 suite set plus plugin readiness and code modularity tie-breaker metrics, then establish a fresh baseline before continuing optimization.","baseline":"Expanded blocker_failures=1045. Most of the new total comes from plugin_nested_docs_failures=999, which indicates suite execution or summary parsing/setup failure rather than necessarily 999 assertions; plugin_search has 17 failures, database 4, collections_graphql 1, relationships 6, joins 5, uploads 2, queues 11.","result":"Expanded objective and modularity extraction were committed as the new baseline. Green core suites mostly remained green, but the broader objective reveals additional 1.0 blockers outside the previous active sweep.","next_action_hint":"First inspect /tmp/payload-surrealdb-plugin_nested_docs-autoresearch.log.clean to determine why plugin_nested_docs parsed as 999. Fix harness/setup if it is an environment/parser issue; otherwise address true plugin nested docs blockers. Then tackle plugin_search failures and newly exposed database/relationships regressions."}}
{"run":33,"commit":"26c3ce1","metric":48,"metrics":{"database_failures":4,"database_passed":149,"auth_failures":0,"auth_passed":66,"globals_failures":0,"globals_passed":13,"collections_rest_failures":0,"collections_rest_passed":112,"collections_graphql_failures":1,"collections_graphql_passed":46,"fields_failures":0,"fields_passed":157,"sort_failures":0,"sort_passed":37,"select_failures":0,"select_passed":115,"field_paths_failures":0,"field_paths_passed":2,"query_presets_failures":0,"query_presets_passed":11,"relationships_failures":6,"relationships_passed":51,"joins_failures":5,"joins_passed":69,"uploads_failures":2,"uploads_passed":100,"dataloader_failures":0,"dataloader_passed":4,"versions_failures":0,"versions_passed":98,"localization_failures":0,"localization_passed":117,"trash_failures":0,"trash_passed":97,"locked_documents_failures":0,"locked_documents_passed":13,"queues_failures":12,"queues_passed":60,"plugin_nested_docs_failures":1,"plugin_nested_docs_passed":0,"plugin_redirects_failures":0,"plugin_redirects_passed":3,"plugin_search_failures":17,"plugin_search_passed":3,"plugin_seo_failures":0,"plugin_seo_passed":6,"plugin_form_builder_failures":0,"plugin_form_builder_passed":53,"plugin_multi_tenant_failures":0,"plugin_multi_tenant_passed":9,"build_ok":1,"modularity_penalty":2052,"largest_src_file_lines":1326,"operations_lines":1326,"relationships_lines":700,"src_file_count":12,"large_src_files":3,"plugin_suites_enabled":1,"duration_s":1484.767},"status":"keep","description":"Count setup-time failed suites instead of crash sentinel","timestamp":1779853515576,"segment":2,"confidence":null,"asi":{"hypothesis":"The expanded baseline was inflated because plugin-nested-docs times out in beforeAll and reports a failed suite, not 999 individual test failures. Counting Vitest's Failed Suites total when no per-test failure count is available makes blocker_failures reflect real objective failures while still penalizing setup blockers.","result":"blocker_failures dropped from 1045 to 48 by measuring plugin_nested_docs_failures as 1 failed suite instead of the crash sentinel 999. This is a metric correctness fix, not a product behavior fix. Other suite counts are broadly unchanged, with queues showing one noisy extra failure in this run.","learned":"plugin-nested-docs is a true setup-time blocker: beforeAll times out during seeding and all 11 tests are skipped. It should be investigated next as a functional/plugin compatibility issue, not as a parser crash.","next_action_hint":"Inspect plugin-nested-docs seeding and nestedDocs hooks for recursive breadcrumb/update behavior causing init timeout. Next largest true blocker is plugin_search with 17 failures, followed by queues, relationships, joins, database, uploads, and collections_graphql."}}
{"run":34,"commit":"fe8cc62","metric":37,"metrics":{"database_failures":4,"database_passed":149,"auth_failures":0,"auth_passed":66,"globals_failures":0,"globals_passed":13,"collections_rest_failures":0,"collections_rest_passed":112,"collections_graphql_failures":1,"collections_graphql_passed":46,"fields_failures":0,"fields_passed":157,"sort_failures":0,"sort_passed":37,"select_failures":0,"select_passed":115,"field_paths_failures":0,"field_paths_passed":2,"query_presets_failures":0,"query_presets_passed":11,"relationships_failures":6,"relationships_passed":51,"joins_failures":5,"joins_passed":69,"uploads_failures":2,"uploads_passed":100,"dataloader_failures":0,"dataloader_passed":4,"versions_failures":0,"versions_passed":98,"localization_failures":0,"localization_passed":117,"trash_failures":0,"trash_passed":97,"locked_documents_failures":0,"locked_documents_passed":13,"queues_failures":12,"queues_passed":60,"plugin_nested_docs_failures":1,"plugin_nested_docs_passed":0,"plugin_redirects_failures":0,"plugin_redirects_passed":3,"plugin_search_failures":6,"plugin_search_passed":14,"plugin_seo_failures":0,"plugin_seo_passed":6,"plugin_form_builder_failures":0,"plugin_form_builder_passed":53,"plugin_multi_tenant_failures":0,"plugin_multi_tenant_passed":9,"build_ok":1,"modularity_penalty":2062,"largest_src_file_lines":1331,"operations_lines":1331,"relationships_lines":700,"src_file_count":12,"large_src_files":3,"plugin_suites_enabled":1,"duration_s":1429.835},"status":"keep","description":"Include transaction snapshots in findOne reads","timestamp":1779855009398,"segment":2,"confidence":91.63636363636364,"asi":{"hypothesis":"Plugin-search failures come from afterChange hooks calling payload.findByID for a document created in the same transaction. The adapter's find path already merges transaction snapshots, but findOne/findByID did not, causing NotFound before commit.","result":"blocker_failures improved from 48 to 37. plugin_search improved from 17 failures / 3 passed to 6 failures / 14 passed. Core green suites stayed green; queues remained noisy at 12 failures.","learned":"Read-your-writes support was incomplete: findOne must merge queued transaction docs and re-evaluate the where clause against the merged set, not just direct Surreal SELECT results.","next_action_hint":"Continue plugin_search: inspect remaining 6 failures. They likely involve reindex/delete/localized edge cases after the basic afterChange findByID path was fixed. Also investigate plugin-nested-docs beforeAll timeout separately."}}
