{"type":"config","name":"Payload SurrealDB 1.0 conformance","metricName":"blocker_failures","metricUnit":"","bestDirection":"lower"}
{"run":3,"commit":"33189ab","metric":4995,"metrics":{"query_presets_failures":999,"query_presets_passed":0,"trash_failures":999,"trash_passed":0,"uploads_failures":999,"uploads_passed":0,"joins_failures":999,"joins_passed":0,"queues_failures":999,"queues_passed":0,"build_ok":1,"duration_s":1057.586},"status":"crash","description":"Baseline run completed but metric parser failed on ANSI-colored vitest summaries","timestamp":1779726968154,"segment":1,"confidence":null,"asi":{"hypothesis":"Establish full 1.0 sweep baseline after fixing SurrealDB and harness setup.","error":"Suites actually ran, but autoresearch.sh parsed all failures as 999 because Vitest summary lines contain ANSI escape codes between numbers and words.","observed_true_counts":"query-presets 0 failed/11 passed; trash 0 failed/97 passed; uploads 4 failed/98 passed; joins 28 failed/46 passed/1 skipped; queues 71 failed/1 passed/2 skipped.","rollback_reason":"Invalid metric extraction, not an adapter regression.","next_action_hint":"Strip ANSI escape codes before summary parsing, then rerun baseline. Expected valid primary baseline around 103 failures if same results reproduce."}}
{"run":4,"commit":"bb8ddaa","metric":103,"metrics":{"query_presets_failures":0,"query_presets_passed":11,"trash_failures":0,"trash_passed":97,"uploads_failures":4,"uploads_passed":98,"joins_failures":28,"joins_passed":46,"queues_failures":71,"queues_passed":1,"build_ok":1,"duration_s":1075.206},"status":"keep","description":"Valid full 1.0 objective sweep baseline","timestamp":1779728075914,"segment":1,"confidence":null,"asi":{"hypothesis":"Use a broad objective 1.0 blocker metric across green guardrails plus remaining uploads/joins/queues suites.","baseline":"blocker_failures=103 = uploads 4 + joins 28 + queues 71; query-presets and trash are green.","next_action_hint":"Largest objective win is queues: failures stem from seed duplicate email before most queue tests run. Fixing payload_jobs/deleteMany/drop/reset behavior may unlock ~70 tests quickly. Joins next largest; uploads has 2 env paste-url failures plus 2 stale file collision failures."}}
{"run":5,"commit":"bb8ddaa","metric":104,"metrics":{"query_presets_failures":0,"query_presets_passed":11,"trash_failures":0,"trash_passed":97,"uploads_failures":4,"uploads_passed":98,"joins_failures":28,"joins_passed":46,"queues_failures":72,"queues_passed":0,"build_ok":1,"duration_s":1082.201},"status":"discard","description":"Populate drizzle schema for resetDB","timestamp":1779729225682,"segment":1,"confidence":4892,"asi":{"hypothesis":"Giving the adapter a drizzle._.schema would let Payload resetDB delete all tables before queue seeding, eliminating duplicate user failures.","rollback_reason":"Worse primary metric: queues went from 71 to 72 failures. The helper then treated the adapter as full Drizzle and createDrizzleSnapshot crashed on missing db.drizzle.query[tableName].fullSchema.","next_action_hint":"Do not expose a populated drizzle._.schema unless also implementing enough drizzle.query/select snapshot surface. Better options: implement clearDatabase and avoid 'drizzle' branch, or enhance the existing drizzle shim to support snapshot APIs."}}
{"run":6,"commit":"bb8ddaa","metric":104,"metrics":{"query_presets_failures":0,"query_presets_passed":11,"trash_failures":0,"trash_passed":97,"uploads_failures":4,"uploads_passed":98,"joins_failures":28,"joins_passed":46,"queues_failures":72,"queues_passed":0,"build_ok":1,"duration_s":1111.761},"status":"discard","description":"Implement fuller drizzle snapshot shim for queue reset","timestamp":1779730434054,"segment":1,"confidence":9784,"asi":{"hypothesis":"A minimal drizzle query/select/insert shim plus schema would let Payload clearAndSeed reset and snapshot queue fixtures correctly.","rollback_reason":"Still worse than baseline. resetDB attempted DELETE FROM posts_rels from the exposed schema, but that table was registered in adapter metadata without a matching DEFINE TABLE, causing reset errors and duplicate seed failures.","next_action_hint":"If retrying this path, either define every table exposed in drizzle._.schema (including *_rels/locales) or only expose actually-defined tables. Avoid partial schema entries that resetDB will delete."}}
{"run":7,"commit":"3bcfb7f","metric":67,"metrics":{"query_presets_failures":0,"query_presets_passed":11,"trash_failures":0,"trash_passed":97,"uploads_failures":4,"uploads_passed":98,"joins_failures":28,"joins_passed":46,"queues_failures":35,"queues_passed":37,"build_ok":1,"duration_s":1323.058},"status":"keep","description":"Add reset/snapshot-compatible drizzle shim for queue fixtures","timestamp":1779731806609,"segment":1,"confidence":4928,"asi":{"hypothesis":"Expose a minimal but complete drizzle-compatible schema/query/select/insert shim and define all metadata tables so Payload clearAndSeed can reset and snapshot queue fixtures.","result":"queues improved from 71 failed / 1 passed to 35 failed / 37 passed; full 1.0 blocker metric improved from 103 to 67.","learned":"Queue failures were substantially caused by reset/snapshot incompatibility, not only updateJobs runtime behavior. Defining all metadata tables exposed in the shim avoids DELETE missing-table errors.","next_action_hint":"Continue queues: inspect remaining 35 failures. Likely now true job lifecycle/updateJobs/concurrency semantics rather than seed reset."}}
{"run":8,"commit":"dc8cfe4","metric":43,"metrics":{"query_presets_failures":0,"query_presets_passed":11,"trash_failures":0,"trash_passed":97,"uploads_failures":4,"uploads_passed":98,"joins_failures":28,"joins_passed":46,"queues_failures":11,"queues_passed":61,"build_ok":1,"duration_s":1319.179},"status":"keep","description":"Normalize drizzle snapshot records before restore","timestamp":1779733190972,"segment":1,"confidence":267.6756756756757,"asi":{"hypothesis":"Queue login failures after snapshot restore were caused by raw Surreal record IDs in drizzle snapshot rows, so restored users could not be found by Payload string ID.","result":"queues improved from 35 failed / 37 passed to 11 failed / 61 passed; full blocker metric improved from 67 to 43.","learned":"Snapshot rows exposed through the drizzle shim must be normalized with normalizeDocument before caching/restoring, otherwise IDs become record objects and auth lookups fail after restore.","next_action_hint":"Inspect remaining 11 queue failures. They likely concern true queue execution semantics: updateJobs limit/sort, deleteJobOnComplete, retries, cancellation, concurrency/supersedes, or nested task status updates."}}
{"run":9,"commit":"dc8cfe4","metric":1038,"metrics":{"query_presets_failures":0,"query_presets_passed":11,"trash_failures":0,"trash_passed":97,"uploads_failures":999,"uploads_passed":0,"joins_failures":28,"joins_passed":46,"queues_failures":11,"queues_passed":61,"build_ok":1,"duration_s":1189.034},"status":"discard","description":"Try cleaning generated upload files before uploads suite","timestamp":1779734439057,"segment":1,"confidence":133.83783783783784,"asi":{"hypothesis":"Cleaning stale generated upload files before the uploads suite would remove filename collision failures and reduce blocker_failures by 2.","rollback_reason":"The cleanup pattern was too broad and deleted fixture file animated.webp, causing uploads onInit to fail and uploads_failures=999.","next_action_hint":"Do not broad-delete test/uploads files. If addressing uploads noise, only delete known generated static directories or use Payload's seedDB uploadsDir cleanup; first restore fixtures with git checkout in the Payload repo."}}
{"run":10,"commit":"ab110a7","metric":39,"metrics":{"query_presets_failures":0,"query_presets_passed":11,"trash_failures":0,"trash_passed":97,"uploads_failures":3,"uploads_passed":99,"joins_failures":25,"joins_passed":49,"queues_failures":11,"queues_passed":61,"build_ok":1,"duration_s":1275.89},"status":"keep","description":"Treat adapter-populated join fields as non-localized for afterRead","timestamp":1779735875144,"segment":1,"confidence":102.18556701030928,"asi":{"hypothesis":"Payload afterRead was stripping or hoisting adapter-populated join pagination objects when the sanitized join field inherited localized=true from its target relationship; marking join fields non-localized should preserve populated join result shapes.","result":"joins improved from 28 failed / 46 passed to 25 failed / 49 passed; uploads also improved by one noisy file-collision failure; full blocker metric improved from 43 to 39.","learned":"For this adapter, join result objects are already locale-resolved and should not be treated as localized field storage by Payload's afterRead recursion.","next_action_hint":"Continue joins: remaining failures still include collection-array sorting/query shape, access/filter/pagination, and top-level where-by-join timeouts. Consider implementing join-aware where prefilter instead of allowing recursive population loops."}}
{"run":11,"commit":"ab110a7","metric":40,"metrics":{"query_presets_failures":0,"query_presets_passed":11,"trash_failures":0,"trash_passed":97,"uploads_failures":4,"uploads_passed":98,"joins_failures":24,"joins_passed":50,"queues_failures":12,"queues_passed":60,"build_ok":1,"duration_s":1260.665},"status":"discard","description":"Add join page metadata and slicing","timestamp":1779737195493,"segment":1,"confidence":82.6,"asi":{"hypothesis":"Implementing page/start slicing and page metadata for join fields would reduce REST/GraphQL join pagination failures.","rollback_reason":"Primary metric worsened from 39 to 40. Joins improved by 1 (25→24 failures), but queues regressed by 1 and uploads noisy failures increased by 1, so under full 1.0 rubric this is not a keep.","next_action_hint":"The pagination change is promising for joins and may be worth reapplying later with a queues guard or after stabilizing noisy uploads/queues. It likely fixed one join pagination case but must not be kept alone under current primary metric."}}
{"run":12,"commit":"ab110a7","metric":41,"metrics":{"query_presets_failures":0,"query_presets_passed":11,"trash_failures":0,"trash_passed":97,"uploads_failures":4,"uploads_passed":98,"joins_failures":25,"joins_passed":49,"queues_failures":12,"queues_passed":60,"build_ok":1,"duration_s":1288.597},"status":"discard","description":"Support nested object join options lookup","timestamp":1779738626886,"segment":1,"confidence":115.25581395348837,"asi":{"hypothesis":"Some nested join failures may come from Payload passing joins as nested objects instead of dot-path keys, so resolving join options by walking path segments would restore sort/limit/page for group joins.","rollback_reason":"Primary metric worsened from best 39 to 41. Joins did not improve versus best and queues/uploads were noisier in this full sweep.","next_action_hint":"Nested join options lookup alone is not sufficient; group join sort failure likely comes from Payload afterRead repopulation or adapter result shape rather than missing joinOptions. Investigate targeted join logs before retrying."}}
{"run":13,"commit":"fbbd03d","metric":38,"metrics":{"query_presets_failures":0,"query_presets_passed":11,"trash_failures":0,"trash_passed":97,"uploads_failures":2,"uploads_passed":100,"joins_failures":25,"joins_passed":49,"queues_failures":11,"queues_passed":61,"build_ok":1,"duration_s":1286.564},"status":"keep","description":"Clean ignored upload artifacts before uploads conformance sweep","timestamp":1779740002390,"segment":1,"confidence":170.93103448275863,"asi":{"hypothesis":"The remaining non-environment upload failures in the full sweep were caused by ignored/generated upload artifacts from prior runs, so cleaning ignored files in test/uploads before the uploads suite should produce clean-env upload results without deleting tracked fixtures.","result":"uploads improved from 3 failed / 99 passed at best to 2 failed / 100 passed; blocker_failures improved from 39 to 38. The two remaining upload failures are the known localhost/nginx paste-url status expectations.","learned":"Use git clean -fdX scoped to test/uploads, not broad file deletion. This removes ignored generated artifacts while preserving tracked fixture files such as animated.webp.","next_action_hint":"Continue with true adapter blockers: joins 25 failures and queues 11 failures. Uploads can be considered clean-env green except for the documented local nginx paste-url issue."}}
{"run":14,"commit":"fbbd03d","metric":60,"metrics":{"query_presets_failures":0,"query_presets_passed":11,"trash_failures":0,"trash_passed":97,"uploads_failures":2,"uploads_passed":100,"joins_failures":25,"joins_passed":49,"queues_failures":33,"queues_passed":39,"build_ok":1,"duration_s":1251.632},"status":"discard","description":"Use Surreal atomic append for top-level $push updates","timestamp":1779741315033,"segment":1,"confidence":198.28,"asi":{"hypothesis":"Queue parallel task log loss was caused by read-merge-write races for top-level $push updates, so translating $push into Surreal atomic array append should preserve concurrent log entries.","rollback_reason":"Primary metric worsened from 38 to 60; queues regressed from 11 to 33 failures. Atomic append via SET log += [item] caused updateJob calls to return null / jobs to lose expected log state in queue execution paths.","next_action_hint":"Do not use naive Surreal += for $push. If revisiting concurrent log updates, test Surreal array semantics in isolation and ensure UPDATE returns the updated full document. A safer path may be transactional compare/merge or dedicated log sub-records, but avoid changing this without targeted queue tests first."}}
{"run":15,"commit":"f630e7d","metric":35,"metrics":{"query_presets_failures":0,"query_presets_passed":11,"trash_failures":0,"trash_passed":97,"uploads_failures":2,"uploads_passed":100,"joins_failures":21,"joins_passed":53,"queues_failures":12,"queues_passed":60,"build_ok":1,"duration_s":1337.829},"status":"keep","description":"Use lexicographic join sorting to match Payload string sort semantics","timestamp":1779742699700,"segment":1,"confidence":225.45454545454547,"asi":{"hypothesis":"Several join sort failures were caused by adapter-side join sorting using numeric string collation, which orders titles like 'test 14' after 'test 9' differently than Payload/DB lexicographic string sort expectations.","result":"joins improved from 25 failed / 49 passed to 21 failed / 53 passed; full blocker metric improved from 38 to 35 despite one noisy queue failure regression.","learned":"Join field sorting should use plain lexicographic string comparison, not numeric collation. Numeric-aware sorting overfits human-natural ordering and breaks Payload's expected string order for titles with embedded numbers.","next_action_hint":"Continue joins. Remaining failures now likely include localized/versioned joins, collection-array explicit sort/filter, access filters, and top-level where-by-join timeouts."}}
{"run":16,"commit":"4106e04","metric":33,"metrics":{"query_presets_failures":0,"query_presets_passed":11,"trash_failures":0,"trash_passed":97,"uploads_failures":2,"uploads_passed":100,"joins_failures":20,"joins_passed":54,"queues_failures":11,"queues_passed":61,"build_ok":1,"duration_s":1319.589},"status":"keep","description":"Honor join page offsets and pagination metadata","timestamp":1779744091639,"segment":1,"confidence":310.125,"asi":{"hypothesis":"After lexicographic sorting stabilized join order, implementing adapter-side join page offsets and metadata should fix REST join pagination without the earlier noisy regressions.","result":"joins improved from 21 failed / 53 passed to 20 failed / 54 passed; full blocker metric improved from 35 to 33.","learned":"Join pagination needs start=(page-1)*limit slicing plus hasPrevPage/hasNextPage/page/pagingCounter metadata. This is now a real improvement when combined with correct string sort semantics.","next_action_hint":"Continue joins. Remaining failures include localized/versioned joins, collection-array explicit sort/filter, access filtering, and top-level where-by-join timeouts."}}
{"run":17,"commit":"34f1c0b","metric":32,"metrics":{"query_presets_failures":0,"query_presets_passed":11,"trash_failures":0,"trash_passed":97,"uploads_failures":2,"uploads_passed":100,"joins_failures":18,"joins_passed":56,"queues_failures":12,"queues_passed":60,"build_ok":1,"duration_s":1301.298},"status":"keep","description":"Apply join where filters during adapter join fetches","timestamp":1779745434504,"segment":1,"confidence":451.1818181818182,"asi":{"hypothesis":"Join field `where` config and requested join `where` options were not applied in adapter-side join population, causing filter-specific join tests to return all joined docs.","result":"joins improved from 20 failed / 54 passed to 18 failed / 56 passed; full blocker metric improved from 33 to 32 despite one noisy queue regression.","learned":"Adapter join fetches need to compile join where filters into the target collection SELECT before grouping by parent. This directly fixes join filtering cases and is not benchmark-specific.","next_action_hint":"Continue joins. Remaining likely include localized/versioned joins, collection-array explicit sort/filter, access filtering, and top-level where-by-join timeouts. Consider merging field.where with joinOptions.where instead of choosing one if a remaining failure shows combined filters are wrong."}}
{"run":18,"commit":"8a91605","metric":29,"metrics":{"query_presets_failures":0,"query_presets_passed":11,"trash_failures":0,"trash_passed":97,"uploads_failures":2,"uploads_passed":100,"joins_failures":15,"joins_passed":59,"queues_failures":12,"queues_passed":60,"build_ok":1,"duration_s":1313.525},"status":"keep","description":"Handle relationTo filters in polymorphic join queries","timestamp":1779746819074,"segment":1,"confidence":431.82608695652175,"asi":{"hypothesis":"Polymorphic join where clauses include virtual relationTo predicates that should select which target collections are queried, not be compiled as fields on target documents.","result":"joins improved from 18 failed / 56 passed to 15 failed / 59 passed; full blocker metric improved from 32 to 29 despite one noisy queue regression.","learned":"For adapter-populated polymorphic joins, relationTo is result metadata. The adapter must consume relationTo filters per target collection and remove matching predicates before compiling the target collection WHERE clause.","next_action_hint":"Continue joins. Remaining failures include localized/versioned joins, collection-array explicit sort/filter shape, access filtering, and top-level where-by-join timeouts."}}
{"run":19,"commit":"8a91605","metric":29,"metrics":{"query_presets_failures":0,"query_presets_passed":11,"trash_failures":0,"trash_passed":97,"uploads_failures":2,"uploads_passed":100,"joins_failures":15,"joins_passed":59,"queues_failures":12,"queues_passed":60,"build_ok":1,"duration_s":1297.705},"status":"discard","description":"Resolve localized join values by request locale","timestamp":1779748261210,"segment":1,"confidence":413.8333333333333,"asi":{"hypothesis":"Localized join failures may be caused by flattenJoinValues scanning all locales or defaulting incorrectly instead of using the request locale when resolving localized relationship arrays.","rollback_reason":"Primary metric was unchanged at 29, so no objective improvement. It did not reduce localized join failures in the full 1.0 sweep.","next_action_hint":"Localized join failures are likely not simply locale selection in flattenJoinValues. Investigate target document locale flattening / fallback and version-draft join sources before retrying."}}
{"run":20,"commit":"8a91605","metric":29,"metrics":{"query_presets_failures":0,"query_presets_passed":11,"trash_failures":0,"trash_passed":97,"uploads_failures":2,"uploads_passed":100,"joins_failures":15,"joins_passed":59,"queues_failures":12,"queues_passed":60,"build_ok":1,"duration_s":689.545},"status":"discard","description":"Reduce client-side virtual join population depth","timestamp":1779748992440,"segment":1,"confidence":431.82608695652175,"asi":{"hypothesis":"Top-level where-by-join tests time out because client-side virtual filtering populates relationship/join graphs to depth 5; depth 1 may be sufficient for join field predicates and reduce recursive work.","rollback_reason":"Primary metric was unchanged at 29 despite faster runtime, so per full 1.0 rubric this is not a keep.","next_action_hint":"Depth reduction improved duration but not failures. To fix top-level join where tests, implement true join-aware parent prefiltering or improve docMatchesWhere for join pagination objects rather than only reducing population depth."}}
