{"run":52,"commit":"0482da0","metric":18,"metrics":{"database_failures":0,"database_passed":153,"auth_failures":0,"auth_passed":66,"globals_failures":0,"globals_passed":13,"collections_rest_failures":0,"collections_rest_passed":112,"collections_graphql_failures":0,"collections_graphql_passed":47,"fields_failures":0,"fields_passed":157,"sort_failures":0,"sort_passed":37,"select_failures":0,"select_passed":115,"field_paths_failures":0,"field_paths_passed":2,"query_presets_failures":0,"query_presets_passed":11,"relationships_failures":0,"relationships_passed":57,"joins_failures":4,"joins_passed":70,"uploads_failures":2,"uploads_passed":100,"dataloader_failures":0,"dataloader_passed":4,"versions_failures":0,"versions_passed":98,"localization_failures":0,"localization_passed":117,"trash_failures":0,"trash_passed":97,"locked_documents_failures":0,"locked_documents_passed":13,"queues_failures":12,"queues_passed":60,"plugin_nested_docs_failures":0,"plugin_nested_docs_passed":11,"plugin_redirects_failures":0,"plugin_redirects_passed":3,"plugin_search_failures":0,"plugin_search_passed":20,"plugin_seo_failures":0,"plugin_seo_passed":6,"plugin_form_builder_failures":0,"plugin_form_builder_passed":53,"plugin_multi_tenant_failures":0,"plugin_multi_tenant_passed":9,"build_ok":1,"modularity_penalty":2228,"largest_src_file_lines":1400,"operations_lines":1400,"relationships_lines":728,"src_file_count":12,"large_src_files":3,"plugin_suites_enabled":1,"duration_s":1525.897},"status":"keep","description":"Re-filter transaction-merged find results by where","timestamp":1779885176663,"segment":2,"confidence":513.5,"asi":{"hypothesis":"When a transactional update changes a document so it no longer matches the original SQL WHERE, find() can query the old committed row, merge in the transaction snapshot, and return the snapshot without rechecking the predicate. Re-filtering transaction-merged results should make same-transaction draft/published lookups obey read-your-writes semantics.","result":"blocker_failures improved from best 19 to 18. plugin_search is now green (1→0 failures), and plugin_nested_docs also completed green in this run instead of timing out. Joins stayed at 4 failures; queues were noisy at 12 failures but net primary still improved.","learned":"Transaction read snapshots need post-merge predicate filtering for ordinary non-virtual find(), just like count/findOne already did. This fixes published-to-draft search deletion semantics and may reduce hook recursion/timeouts by exposing consistent same-transaction reads.","next_action_hint":"Remaining objective failures are joins=4, uploads=2 local paste-url env, and queues≈12 lifecycle/noise. Focus joins GraphQL group pagination timeout / collection-array ordering, or queue retry/cancel/supersedes semantics. Consider refactoring transaction visibility helpers later because operations.ts is now very large."}}
{"run":53,"commit":"37380ba","metric":17,"metrics":{"database_failures":0,"database_passed":153,"auth_failures":0,"auth_passed":66,"globals_failures":0,"globals_passed":13,"collections_rest_failures":0,"collections_rest_passed":112,"collections_graphql_failures":0,"collections_graphql_passed":47,"fields_failures":0,"fields_passed":157,"sort_failures":0,"sort_passed":37,"select_failures":0,"select_passed":115,"field_paths_failures":0,"field_paths_passed":2,"query_presets_failures":0,"query_presets_passed":11,"relationships_failures":0,"relationships_passed":57,"joins_failures":4,"joins_passed":70,"uploads_failures":2,"uploads_passed":100,"dataloader_failures":0,"dataloader_passed":4,"versions_failures":0,"versions_passed":98,"localization_failures":0,"localization_passed":117,"trash_failures":0,"trash_passed":97,"locked_documents_failures":0,"locked_documents_passed":13,"queues_failures":11,"queues_passed":61,"plugin_nested_docs_failures":0,"plugin_nested_docs_passed":11,"plugin_redirects_failures":0,"plugin_redirects_passed":3,"plugin_search_failures":0,"plugin_search_passed":20,"plugin_seo_failures":0,"plugin_seo_passed":6,"plugin_form_builder_failures":0,"plugin_form_builder_passed":53,"plugin_multi_tenant_failures":0,"plugin_multi_tenant_passed":9,"build_ok":1,"modularity_penalty":2228,"largest_src_file_lines":1400,"operations_lines":1400,"relationships_lines":728,"src_file_count":12,"large_src_files":3,"plugin_suites_enabled":1,"duration_s":1558.472},"status":"keep","description":"Serialize updateJobs selection and mutation","timestamp":1779886885388,"segment":2,"confidence":228.44444444444446,"asi":{"hypothesis":"Queue worker concurrency can race inside updateJobs because it performs a find selection followed by per-job updates. Serializing updateJobs selection and mutation with the existing job update lock should reduce duplicate/stale job claiming without changing Payload's job semantics.","result":"blocker_failures improved from best 18 to 17. Queue failures improved from the prior run's 12 to 11 while plugin-search and plugin-nested-docs stayed green. All guardrails remained green.","learned":"Some remaining queue failures are sensitive to the non-atomic select-then-update window in updateJobs. A coarse in-process updateJobs lock is conservative but aligns this adapter's local runner semantics with atomic job claiming expectations better than leaving selection races exposed.","next_action_hint":"Continue queues: remaining 11 failures still include retry/backoff/cancellation/parallel-log/supersedes cases. Investigate lost concurrent log updates or updateMany/updateJobs atomicity more specifically. Joins=4 and uploads=2 also remain."}}
{"run":54,"commit":"78826cb","metric":16,"metrics":{"database_failures":0,"database_passed":153,"auth_failures":0,"auth_passed":66,"globals_failures":0,"globals_passed":13,"collections_rest_failures":0,"collections_rest_passed":112,"collections_graphql_failures":0,"collections_graphql_passed":47,"fields_failures":0,"fields_passed":157,"sort_failures":0,"sort_passed":37,"select_failures":0,"select_passed":115,"field_paths_failures":0,"field_paths_passed":2,"query_presets_failures":0,"query_presets_passed":11,"relationships_failures":0,"relationships_passed":57,"joins_failures":3,"joins_passed":71,"uploads_failures":2,"uploads_passed":100,"dataloader_failures":0,"dataloader_passed":4,"versions_failures":0,"versions_passed":98,"localization_failures":0,"localization_passed":117,"trash_failures":0,"trash_passed":97,"locked_documents_failures":0,"locked_documents_passed":13,"queues_failures":11,"queues_passed":61,"plugin_nested_docs_failures":0,"plugin_nested_docs_passed":11,"plugin_redirects_failures":0,"plugin_redirects_passed":3,"plugin_search_failures":0,"plugin_search_passed":20,"plugin_seo_failures":0,"plugin_seo_passed":6,"plugin_form_builder_failures":0,"plugin_form_builder_passed":53,"plugin_multi_tenant_failures":0,"plugin_multi_tenant_passed":9,"build_ok":1,"modularity_penalty":2230,"largest_src_file_lines":1400,"operations_lines":1400,"relationships_lines":730,"src_file_count":12,"large_src_files":3,"plugin_suites_enabled":1,"duration_s":1565.753},"status":"keep","description":"Use sort direction for collection-array join tie ordering","timestamp":1779888662688,"segment":2,"confidence":171.5,"asi":{"hypothesis":"Collection-array joins need deterministic cross-collection fallback ordering when the requested sort path compares equal or is unavailable on wrapper docs. The fallback should respect the requested sort direction instead of always sorting relationTo descending.","result":"blocker_failures improved from best 17 to 16. joins improved from 4 to 3 failures while queues remained at 11 failures and plugin suites stayed green.","learned":"The remaining collection-array join ordering failure was caused by cross-collection tie handling, not by missing join options. Direction-aware relationTo fallback matches both ascending and descending collection-array join sort expectations.","next_action_hint":"Remaining joins are localized request-locale cases and GraphQL group pagination timeout. Queues still have 11 retry/backoff/cancel/parallel/supersedes failures, and uploads has 2 local paste-url failures."}}
{"run":55,"commit":"307dc12","metric":15,"metrics":{"database_failures":0,"database_passed":153,"auth_failures":0,"auth_passed":66,"globals_failures":0,"globals_passed":13,"collections_rest_failures":0,"collections_rest_passed":112,"collections_graphql_failures":0,"collections_graphql_passed":47,"fields_failures":0,"fields_passed":157,"sort_failures":0,"sort_passed":37,"select_failures":0,"select_passed":115,"field_paths_failures":0,"field_paths_passed":2,"query_presets_failures":0,"query_presets_passed":11,"relationships_failures":0,"relationships_passed":57,"joins_failures":3,"joins_passed":71,"uploads_failures":2,"uploads_passed":100,"dataloader_failures":0,"dataloader_passed":4,"versions_failures":0,"versions_passed":98,"localization_failures":0,"localization_passed":117,"trash_failures":0,"trash_passed":97,"locked_documents_failures":0,"locked_documents_passed":13,"queues_failures":10,"queues_passed":62,"plugin_nested_docs_failures":0,"plugin_nested_docs_passed":11,"plugin_redirects_failures":0,"plugin_redirects_passed":3,"plugin_search_failures":0,"plugin_search_passed":20,"plugin_seo_failures":0,"plugin_seo_passed":6,"plugin_form_builder_failures":0,"plugin_form_builder_passed":53,"plugin_multi_tenant_failures":0,"plugin_multi_tenant_passed":9,"build_ok":1,"modularity_penalty":2233,"largest_src_file_lines":1400,"operations_lines":1400,"relationships_lines":733,"src_file_count":12,"large_src_files":3,"plugin_suites_enabled":1,"duration_s":1562.572},"status":"keep","description":"Pass request locale into localized join wrapper resolution","timestamp":1779890516292,"segment":2,"confidence":171.66666666666666,"asi":{"hypothesis":"After default-locale wrapper resolution and collection-array sort fixes, localized join resolution can safely use the request locale when one is available, while falling back to default locale otherwise. This should make explicit non-default locale join population choose es/de relationship wrappers instead of always using en.","result":"blocker_failures improved from best 16 to 15. Queues were favorable at 10 failures, and all plugin/green guardrail suites stayed green. Joins remained at 3 failures in aggregate, so the observed primary improvement came from queue noise/improvement rather than a counted join reduction.","learned":"Passing request locale through relationship read transforms is now safe under the full sweep and does not regress green suites. However current remaining join failures did not decrease, suggesting those explicit localized cases may also need target doc locale transforms or requested locale propagation elsewhere in Payload afterRead/GraphQL paths.","next_action_hint":"Inspect current joins log to see whether localized failure messages changed. Remaining objective: joins=3, queues=10, uploads=2. Queue retries/backoff/cancel remain the largest failure cluster; GraphQL group pagination timeout is the largest join blocker."}}
{"run":56,"commit":"307dc12","metric":16,"metrics":{"database_failures":0,"database_passed":153,"auth_failures":0,"auth_passed":66,"globals_failures":0,"globals_passed":13,"collections_rest_failures":0,"collections_rest_passed":112,"collections_graphql_failures":0,"collections_graphql_passed":47,"fields_failures":0,"fields_passed":157,"sort_failures":0,"sort_passed":37,"select_failures":0,"select_passed":115,"field_paths_failures":0,"field_paths_passed":2,"query_presets_failures":0,"query_presets_passed":11,"relationships_failures":0,"relationships_passed":57,"joins_failures":3,"joins_passed":71,"uploads_failures":2,"uploads_passed":100,"dataloader_failures":0,"dataloader_passed":4,"versions_failures":0,"versions_passed":98,"localization_failures":0,"localization_passed":117,"trash_failures":0,"trash_passed":97,"locked_documents_failures":0,"locked_documents_passed":13,"queues_failures":11,"queues_passed":61,"plugin_nested_docs_failures":0,"plugin_nested_docs_passed":11,"plugin_redirects_failures":0,"plugin_redirects_passed":3,"plugin_search_failures":0,"plugin_search_passed":20,"plugin_seo_failures":0,"plugin_seo_passed":6,"plugin_form_builder_failures":0,"plugin_form_builder_passed":53,"plugin_multi_tenant_failures":0,"plugin_multi_tenant_passed":9,"build_ok":1,"modularity_penalty":2249,"largest_src_file_lines":1400,"operations_lines":1400,"relationships_lines":749,"src_file_count":12,"large_src_files":3,"plugin_suites_enabled":1,"duration_s":1564.163},"status":"discard","description":"Support nested object lookup for join options","timestamp":1779892199014,"segment":2,"confidence":171.66666666666666,"asi":{"hypothesis":"GraphQL group join pagination timeout may still be caused by sanitized joins being provided as nested objects (group.relatedPosts) instead of dot-path keys, so resolving join options by walking nested join option objects should restore limit/sort for grouped joins.","result":"No objective improvement. joins stayed at 3 failures and queues worsened from best 10 to 11, raising blocker_failures from best 15 to 16.","rollback_reason":"Primary metric worsened and the targeted GraphQL grouped join timeout did not improve. The helper also increased relationships.ts size/modularity penalty.","next_action_hint":"Do not retry nested join option lookup alone. Investigate GraphQL group pagination timeout elsewhere, likely afterRead repopulation/recursive depth or GraphQL resolver behavior. Queue failures remain the largest cluster and may be more productive."}}
{"run":55,"commit":"307dc12","metric":15,"metrics":{"database_failures":0,"database_passed":153,"auth_failures":0,"auth_passed":66,"globals_failures":0,"globals_passed":13,"collections_rest_failures":0,"collections_rest_passed":112,"collections_graphql_failures":0,"collections_graphql_passed":47,"fields_failures":0,"fields_passed":157,"sort_failures":0,"sort_passed":37,"select_failures":0,"select_passed":115,"field_paths_failures":0,"field_paths_passed":2,"query_presets_failures":0,"query_presets_passed":11,"relationships_failures":0,"relationships_passed":57,"joins_failures":3,"joins_passed":71,"uploads_failures":2,"uploads_passed":100,"dataloader_failures":0,"dataloader_passed":4,"versions_failures":0,"versions_passed":98,"localization_failures":0,"localization_passed":117,"trash_failures":0,"trash_passed":97,"locked_documents_failures":0,"locked_documents_passed":13,"queues_failures":10,"queues_passed":62,"plugin_nested_docs_failures":0,"plugin_nested_docs_passed":11,"plugin_redirects_failures":0,"plugin_redirects_passed":3,"plugin_search_failures":0,"plugin_search_passed":20,"plugin_seo_failures":0,"plugin_seo_passed":6,"plugin_form_builder_failures":0,"plugin_form_builder_passed":53,"plugin_multi_tenant_failures":0,"plugin_multi_tenant_passed":9,"build_ok":1,"modularity_penalty":2249,"largest_src_file_lines":1408,"operations_lines":1408,"relationships_lines":733,"src_file_count":12,"large_src_files":3,"plugin_suites_enabled":1,"duration_s":1808.441},"status":"discard","description":"Serialize all payload job mutations behind one lock","timestamp":1779895440759,"segment":1,"confidence":158.46153846153845,"asi":{"hypothesis":"The remaining queue failures may come from updateJobs, direct job updates, and supersedes deletes racing through separate lock keys. Serializing all payload-jobs update/delete mutations behind a single in-process lock should provide Mongo-like single-document visibility for the local worker and prevent lost task logs or deletion of newly-processing jobs.","result":"Primary blocker_failures was unchanged at 15. queues stayed at the best observed 10 failures, joins stayed at 3, and uploads stayed at 2, but modularity and file-size metrics worsened and runtime increased.","rollback_reason":"No conformance improvement over the current best and the change worsened operations.ts size/modularity. A global job mutation lock is too broad to keep without reducing failures.","next_action_hint":"Do not retry broad global payload-jobs serialization. Target a specific queue semantic instead: retry/backoff nextRunAt and totalTried behavior, cancellation state transitions, or supersedes delete predicates/processing visibility."}}
{"run":56,"commit":"307dc12","metric":17,"metrics":{"database_failures":0,"database_passed":153,"auth_failures":0,"auth_passed":66,"globals_failures":0,"globals_passed":13,"collections_rest_failures":0,"collections_rest_passed":112,"collections_graphql_failures":0,"collections_graphql_passed":47,"fields_failures":0,"fields_passed":157,"sort_failures":0,"sort_passed":37,"select_failures":0,"select_passed":115,"field_paths_failures":0,"field_paths_passed":2,"query_presets_failures":0,"query_presets_passed":11,"relationships_failures":0,"relationships_passed":57,"joins_failures":3,"joins_passed":71,"uploads_failures":2,"uploads_passed":100,"dataloader_failures":0,"dataloader_passed":4,"versions_failures":0,"versions_passed":98,"localization_failures":0,"localization_passed":117,"trash_failures":0,"trash_passed":97,"locked_documents_failures":0,"locked_documents_passed":13,"queues_failures":12,"queues_passed":60,"plugin_nested_docs_failures":0,"plugin_nested_docs_passed":11,"plugin_redirects_failures":0,"plugin_redirects_passed":3,"plugin_search_failures":0,"plugin_search_passed":20,"plugin_seo_failures":0,"plugin_seo_passed":6,"plugin_form_builder_failures":0,"plugin_form_builder_passed":53,"plugin_multi_tenant_failures":0,"plugin_multi_tenant_passed":9,"build_ok":1,"modularity_penalty":2233,"largest_src_file_lines":1400,"operations_lines":1400,"relationships_lines":733,"src_file_count":12,"large_src_files":3,"plugin_suites_enabled":1,"duration_s":1859.53},"status":"discard","description":"Use scalar INSIDE for non-array in/not_in filters","timestamp":1779897417933,"segment":1,"confidence":128.75,"asi":{"hypothesis":"Queue concurrency filtering may not exclude running concurrency keys because scalar NOT IN is compiled with Surreal's collection membership syntax incorrectly. Using scalar INSIDE/negated INSIDE for non-array in/not_in filters should make running-key exclusion precise without changing hasMany array filters.","result":"Primary blocker_failures worsened from best 15 to 17. queues regressed from best 10 to 12 failures, while joins and uploads were unchanged.","rollback_reason":"The scalar INSIDE rewrite did not fix queue concurrency and made the queue suite worse. Existing IN/NOT IN behavior is not the cause of the remaining concurrency-control failures, or the semantic change affected other queue selection predicates adversely.","next_action_hint":"Do not retry broad scalar in/not_in rewrites. Focus retry/backoff and cancellation update semantics or inspect specific updateJobs data shapes for totalTried/taskStatus persistence."}}
{"run":57,"commit":"307dc12","metric":16,"metrics":{"database_failures":0,"database_passed":153,"auth_failures":0,"auth_passed":66,"globals_failures":0,"globals_passed":13,"collections_rest_failures":0,"collections_rest_passed":112,"collections_graphql_failures":0,"collections_graphql_passed":47,"fields_failures":0,"fields_passed":157,"sort_failures":0,"sort_passed":37,"select_failures":0,"select_passed":115,"field_paths_failures":0,"field_paths_passed":2,"query_presets_failures":0,"query_presets_passed":11,"relationships_failures":0,"relationships_passed":57,"joins_failures":3,"joins_passed":71,"uploads_failures":2,"uploads_passed":100,"dataloader_failures":0,"dataloader_passed":4,"versions_failures":0,"versions_passed":98,"localization_failures":0,"localization_passed":117,"trash_failures":0,"trash_passed":97,"locked_documents_failures":0,"locked_documents_passed":13,"queues_failures":11,"queues_passed":61,"plugin_nested_docs_failures":0,"plugin_nested_docs_passed":11,"plugin_redirects_failures":0,"plugin_redirects_passed":3,"plugin_search_failures":0,"plugin_search_passed":20,"plugin_seo_failures":0,"plugin_seo_passed":6,"plugin_form_builder_failures":0,"plugin_form_builder_passed":53,"plugin_multi_tenant_failures":0,"plugin_multi_tenant_passed":9,"build_ok":1,"modularity_penalty":2235,"largest_src_file_lines":1401,"operations_lines":1401,"relationships_lines":733,"src_file_count":12,"large_src_files":3,"plugin_suites_enabled":1,"duration_s":1841.624},"status":"discard","description":"Apply payload job updates immediately outside transaction queue","timestamp":1779899469917,"segment":1,"confidence":121.17647058823529,"asi":{"hypothesis":"Payload's queue utility starts a transaction around each job update, but adapter per-job locks release when updateOne queues the statement, before Payload commits the transaction. Executing payload-jobs updates immediately instead of queuing them should keep the existing same-job lock around the actual write and reduce lost log/retry updates.","result":"Primary blocker_failures worsened from best 15 to 16. queues were 11 instead of the best 10, with joins and uploads unchanged.","rollback_reason":"Bypassing transaction queuing for payload-jobs updates did not reduce queue failures and slightly worsened the primary metric. It may alter Payload's expected job update transaction boundaries without addressing the true retry/concurrency issues.","next_action_hint":"Do not retry immediate payload-jobs updates as a broad fix. Inspect exact queue update data and where predicates for retry/backoff or cancellation; target a smaller semantic such as treating completedAt:null as absent for runnable jobs or preserving array log pushes atomically."}}
