{"run":44,"commit":"a3eb8c4","metric":33,"metrics":{"database_failures":0,"database_passed":153,"auth_failures":0,"auth_passed":66,"globals_failures":0,"globals_passed":13,"collections_rest_failures":0,"collections_rest_passed":112,"collections_graphql_failures":1,"collections_graphql_passed":46,"fields_failures":0,"fields_passed":157,"sort_failures":0,"sort_passed":37,"select_failures":0,"select_passed":115,"field_paths_failures":0,"field_paths_passed":2,"query_presets_failures":0,"query_presets_passed":11,"relationships_failures":1,"relationships_passed":56,"joins_failures":12,"joins_passed":62,"uploads_failures":2,"uploads_passed":100,"dataloader_failures":0,"dataloader_passed":4,"versions_failures":0,"versions_passed":98,"localization_failures":0,"localization_passed":117,"trash_failures":0,"trash_passed":97,"locked_documents_failures":0,"locked_documents_passed":13,"queues_failures":11,"queues_passed":61,"plugin_nested_docs_failures":1,"plugin_nested_docs_passed":0,"plugin_redirects_failures":0,"plugin_redirects_passed":3,"plugin_search_failures":5,"plugin_search_passed":15,"plugin_seo_failures":0,"plugin_seo_passed":6,"plugin_form_builder_failures":0,"plugin_form_builder_passed":53,"plugin_multi_tenant_failures":0,"plugin_multi_tenant_passed":9,"build_ok":1,"modularity_penalty":2086,"largest_src_file_lines":1343,"operations_lines":1343,"relationships_lines":700,"src_file_count":12,"large_src_files":3,"plugin_suites_enabled":1,"duration_s":2071.767},"status":"keep","description":"Use depth 2 for client-side virtual filtering","timestamp":1779871170669,"segment":2,"confidence":1012,"asi":{"hypothesis":"Remaining database virtual-field and relationship nested-query failures need populated relationship chains two levels deep during client-side virtual filtering/sorting. Depth 1 was enough for join where predicates but insufficient for virtual aliases such as post.category.title.","result":"blocker_failures improved from best 34 to 33. Database became green (3→0 failures) and relationships improved substantially (5→1), while joins regressed from 5 to 12 and runtime increased. Net primary still improved by 1.","learned":"Client-side virtual handling needs depth 2 for general relationship virtuals. However applying depth 2 globally to all client virtual paths over-populates join where cases and regresses joins, so a future refinement should compute depth by virtual alias/path type: depth 2 for relationship virtual paths, depth 1 for join-field predicates.","next_action_hint":"Refine client virtual population depth dynamically to recover join regressions while preserving database/relationship gains. Detect join-root where predicates and keep depth 1 for those; use depth 2 only for virtual aliases / relationship nested paths."}}
{"run":45,"commit":"3bab970","metric":28,"metrics":{"database_failures":0,"database_passed":153,"auth_failures":0,"auth_passed":66,"globals_failures":0,"globals_passed":13,"collections_rest_failures":0,"collections_rest_passed":112,"collections_graphql_failures":1,"collections_graphql_passed":46,"fields_failures":0,"fields_passed":157,"sort_failures":0,"sort_passed":37,"select_failures":0,"select_passed":115,"field_paths_failures":0,"field_paths_passed":2,"query_presets_failures":0,"query_presets_passed":11,"relationships_failures":1,"relationships_passed":56,"joins_failures":5,"joins_passed":69,"uploads_failures":2,"uploads_passed":100,"dataloader_failures":0,"dataloader_passed":4,"versions_failures":0,"versions_passed":98,"localization_failures":0,"localization_passed":117,"trash_failures":0,"trash_passed":97,"locked_documents_failures":0,"locked_documents_passed":13,"queues_failures":13,"queues_passed":59,"plugin_nested_docs_failures":1,"plugin_nested_docs_passed":0,"plugin_redirects_failures":0,"plugin_redirects_passed":3,"plugin_search_failures":5,"plugin_search_passed":15,"plugin_seo_failures":0,"plugin_seo_passed":6,"plugin_form_builder_failures":0,"plugin_form_builder_passed":53,"plugin_multi_tenant_failures":0,"plugin_multi_tenant_passed":9,"build_ok":1,"modularity_penalty":2140,"largest_src_file_lines":1370,"operations_lines":1370,"relationships_lines":700,"src_file_count":12,"large_src_files":3,"plugin_suites_enabled":1,"duration_s":1441.11},"status":"keep","description":"Use shallow client depth for join-field predicates","timestamp":1779872775416,"segment":2,"confidence":1017,"asi":{"hypothesis":"Depth 2 is needed for ordinary relationship virtual paths, but join-field predicates should keep shallow depth 1 to avoid recursive over-population and the join regressions introduced by the global depth-2 change.","result":"blocker_failures improved from best 33 to 28. Database stayed green, relationships stayed at 1 failure, and joins recovered from 12 failures back to 5. Queues were noisy at 13 failures, but the net primary improvement was large.","learned":"Client-side virtual population depth must be path-sensitive. Join predicates need shallow population through join pagination docs; ordinary virtual relationship paths need depth 2 for nested relationship values.","next_action_hint":"This added pathContainsJoinField/whereUsesJoinField logic inside operations.ts and increased modularity_penalty. Consider later extracting path/field introspection helpers once conformance is stable. Continue with plugin_search remaining 5 failures or plugin_nested_docs setup timeout."}}
{"run":46,"commit":"16d64e9","metric":27,"metrics":{"database_failures":0,"database_passed":153,"auth_failures":0,"auth_passed":66,"globals_failures":0,"globals_passed":13,"collections_rest_failures":0,"collections_rest_passed":112,"collections_graphql_failures":1,"collections_graphql_passed":46,"fields_failures":0,"fields_passed":157,"sort_failures":0,"sort_passed":37,"select_failures":0,"select_passed":115,"field_paths_failures":0,"field_paths_passed":2,"query_presets_failures":0,"query_presets_passed":11,"relationships_failures":0,"relationships_passed":57,"joins_failures":5,"joins_passed":69,"uploads_failures":2,"uploads_passed":100,"dataloader_failures":0,"dataloader_passed":4,"versions_failures":0,"versions_passed":98,"localization_failures":0,"localization_passed":117,"trash_failures":0,"trash_passed":97,"locked_documents_failures":0,"locked_documents_passed":13,"queues_failures":13,"queues_passed":59,"plugin_nested_docs_failures":1,"plugin_nested_docs_passed":0,"plugin_redirects_failures":0,"plugin_redirects_passed":3,"plugin_search_failures":5,"plugin_search_passed":15,"plugin_seo_failures":0,"plugin_seo_passed":6,"plugin_form_builder_failures":0,"plugin_form_builder_passed":53,"plugin_multi_tenant_failures":0,"plugin_multi_tenant_passed":9,"build_ok":1,"modularity_penalty":2140,"largest_src_file_lines":1370,"operations_lines":1370,"relationships_lines":700,"src_file_count":12,"large_src_files":3,"plugin_suites_enabled":1,"duration_s":1501.751},"status":"keep","description":"Use depth 3 for non-join client virtual filtering","timestamp":1779874439069,"segment":2,"confidence":1018,"asi":{"hypothesis":"After separating join predicates back to shallow depth, the remaining relationships failure is a 4x-deep relationship where path (`movie.director.movie.name`) that needs depth 3 for non-join client-side virtual filtering.","result":"blocker_failures improved from best 28 to 27. Relationships suite is now green (1→0 failures / 57 passed). Database remains green; joins remain at 5 failures. Queues are noisy at 13 failures but the primary still improved.","learned":"Non-join client-side relationship/virtual filtering needs depth 3 to cover Payload's 4x-deep relationship query semantics. Join predicates still need depth 1, so the path-sensitive split remains important.","next_action_hint":"Remaining blockers: plugin_search reindex/delete/localization (5), joins localized/GraphQL/collection-array (5), uploads env (2), collections_graphql multi-sort (1), plugin_nested_docs setup timeout (1), queues noisy/lifecycle (currently 13). Consider fixing GraphQL multi-sort or plugin_search next."}}
{"run":47,"commit":"e919fbe","metric":25,"metrics":{"database_failures":0,"database_passed":153,"auth_failures":0,"auth_passed":66,"globals_failures":0,"globals_passed":13,"collections_rest_failures":0,"collections_rest_passed":112,"collections_graphql_failures":0,"collections_graphql_passed":47,"fields_failures":0,"fields_passed":157,"sort_failures":0,"sort_passed":37,"select_failures":0,"select_passed":115,"field_paths_failures":0,"field_paths_passed":2,"query_presets_failures":0,"query_presets_passed":11,"relationships_failures":0,"relationships_passed":57,"joins_failures":5,"joins_passed":69,"uploads_failures":2,"uploads_passed":100,"dataloader_failures":0,"dataloader_passed":4,"versions_failures":0,"versions_passed":98,"localization_failures":0,"localization_passed":117,"trash_failures":0,"trash_passed":97,"locked_documents_failures":0,"locked_documents_passed":13,"queues_failures":12,"queues_passed":60,"plugin_nested_docs_failures":1,"plugin_nested_docs_passed":0,"plugin_redirects_failures":0,"plugin_redirects_passed":3,"plugin_search_failures":5,"plugin_search_passed":15,"plugin_seo_failures":0,"plugin_seo_passed":6,"plugin_form_builder_failures":0,"plugin_form_builder_passed":53,"plugin_multi_tenant_failures":0,"plugin_multi_tenant_passed":9,"build_ok":1,"modularity_penalty":2138,"largest_src_file_lines":1369,"operations_lines":1369,"relationships_lines":700,"src_file_count":12,"large_src_files":3,"plugin_suites_enabled":1,"duration_s":1510.804},"status":"keep","description":"Preserve raw comma sort segments and fallback sort","timestamp":1779876153659,"segment":2,"confidence":680,"asi":{"hypothesis":"Payload's sort sanitizer splits comma strings without trimming, and Mongo preserves leading whitespace. GraphQL multi-sort `sort: \"title, number\"` therefore treats the second segment as an invalid raw field and falls back to createdAt desc. The Surreal adapter was trimming segments and incorrectly sorting by number asc.","result":"blocker_failures improved from best 27 to 25. collections_graphql is now green (1→0 failures / 47 passed), and the dedicated sort suite stayed green. Queues were noisy but still net improved.","learned":"Sort parsing must match Payload/Mongo raw comma segment behavior. Filtering empty segments is fine, but trimming changes GraphQL semantics for comma-space sort strings. Existing fallback `createdAt DESC` then provides stable order when a raw segment is invalid.","next_action_hint":"Remaining blockers are plugin_search=5, joins=5, uploads=2, plugin_nested_docs setup=1, and queues noise/lifecycle. Focus plugin_search reindex/delete or plugin_nested_docs timeout next."}}
{"run":48,"commit":"afc57e7","metric":20,"metrics":{"database_failures":0,"database_passed":153,"auth_failures":0,"auth_passed":66,"globals_failures":0,"globals_passed":13,"collections_rest_failures":0,"collections_rest_passed":112,"collections_graphql_failures":0,"collections_graphql_passed":47,"fields_failures":0,"fields_passed":157,"sort_failures":0,"sort_passed":37,"select_failures":0,"select_passed":115,"field_paths_failures":0,"field_paths_passed":2,"query_presets_failures":0,"query_presets_passed":11,"relationships_failures":0,"relationships_passed":57,"joins_failures":5,"joins_passed":69,"uploads_failures":2,"uploads_passed":100,"dataloader_failures":0,"dataloader_passed":4,"versions_failures":0,"versions_passed":98,"localization_failures":0,"localization_passed":117,"trash_failures":0,"trash_passed":97,"locked_documents_failures":0,"locked_documents_passed":13,"queues_failures":11,"queues_passed":61,"plugin_nested_docs_failures":1,"plugin_nested_docs_passed":0,"plugin_redirects_failures":0,"plugin_redirects_passed":3,"plugin_search_failures":1,"plugin_search_passed":19,"plugin_seo_failures":0,"plugin_seo_passed":6,"plugin_form_builder_failures":0,"plugin_form_builder_passed":53,"plugin_multi_tenant_failures":0,"plugin_multi_tenant_passed":9,"build_ok":1,"modularity_penalty":2194,"largest_src_file_lines":1397,"operations_lines":1397,"relationships_lines":700,"src_file_count":12,"large_src_files":3,"plugin_suites_enabled":1,"duration_s":1585.31},"status":"keep","description":"Track transaction deletes in read snapshots","timestamp":1779878087405,"segment":2,"confidence":512.5,"asi":{"hypothesis":"Plugin-search reindex deletes existing search docs and then recreates or updates search docs in the same Payload transaction. The adapter recorded transaction create/update snapshots but not delete tombstones, so same-transaction reads could still see DB rows already scheduled for deletion and update those soon-to-be-deleted rows instead of the newly created search index.","result":"blocker_failures improved from best 25 to 20. plugin_search improved from 5 failures to 1 failure, with reindex cases now passing. Queues also ran at 11 failures instead of 12. All green guardrails stayed green.","learned":"Read-your-writes transaction semantics need delete visibility, not just create/update snapshots. Queued transactional deletes must be represented as tombstones and applied to find/findOne/count before merging in transaction-created docs.","next_action_hint":"Inspect remaining plugin_search failure; likely the published-to-draft deleteDrafts/version query path. Other remaining blockers: joins=5 localized/group/collection-array, uploads=2 local paste-url env, plugin_nested_docs setup=1, queues=11 lifecycle/noise. The new transaction delete tracking increased operations.ts size; refactor transaction visibility helpers later after conformance stabilizes."}}
{"run":49,"commit":"afc57e7","metric":21,"metrics":{"database_failures":0,"database_passed":153,"auth_failures":0,"auth_passed":66,"globals_failures":0,"globals_passed":13,"collections_rest_failures":0,"collections_rest_passed":112,"collections_graphql_failures":0,"collections_graphql_passed":47,"fields_failures":0,"fields_passed":157,"sort_failures":0,"sort_passed":37,"select_failures":0,"select_passed":115,"field_paths_failures":0,"field_paths_passed":2,"query_presets_failures":0,"query_presets_passed":11,"relationships_failures":0,"relationships_passed":57,"joins_failures":5,"joins_passed":69,"uploads_failures":2,"uploads_passed":100,"dataloader_failures":0,"dataloader_passed":4,"versions_failures":0,"versions_passed":98,"localization_failures":0,"localization_passed":117,"trash_failures":0,"trash_passed":97,"locked_documents_failures":0,"locked_documents_passed":13,"queues_failures":12,"queues_passed":60,"plugin_nested_docs_failures":1,"plugin_nested_docs_passed":0,"plugin_redirects_failures":0,"plugin_redirects_passed":3,"plugin_search_failures":1,"plugin_search_passed":19,"plugin_seo_failures":0,"plugin_seo_passed":6,"plugin_form_builder_failures":0,"plugin_form_builder_passed":53,"plugin_multi_tenant_failures":0,"plugin_multi_tenant_passed":9,"build_ok":1,"modularity_penalty":2198,"largest_src_file_lines":1399,"operations_lines":1399,"relationships_lines":700,"src_file_count":12,"large_src_files":3,"plugin_suites_enabled":1,"duration_s":1585.405},"status":"discard","description":"Use transaction snapshot as existing doc for direct ID updates after delete tombstones","timestamp":1779879848589,"segment":2,"confidence":512.5,"asi":{"hypothesis":"Now that transaction delete tombstones fixed plugin-search reindex, direct update-by-id might still need to merge against the transaction snapshot rather than the stale committed DB row during same-request version/search updates.","result":"No plugin_search improvement: it remained at 1 failure, and queue noise raised blocker_failures from best 20 to 21.","rollback_reason":"Primary metric worsened and the targeted plugin-search failure did not change. The change also increased operations.ts size/modularity penalty.","next_action_hint":"Do not retry direct-ID transaction snapshot merging as a standalone fix. Investigate the remaining plugin_search published-to-draft deleteDrafts failure by determining why the plugin's draft:false published lookup still finds a published doc after unpublishing, or shift to joins/plugin_nested_docs/queues."}}
{"run":50,"commit":"afc57e7","metric":21,"metrics":{"database_failures":0,"database_passed":153,"auth_failures":0,"auth_passed":66,"globals_failures":0,"globals_passed":13,"collections_rest_failures":0,"collections_rest_passed":112,"collections_graphql_failures":0,"collections_graphql_passed":47,"fields_failures":0,"fields_passed":157,"sort_failures":0,"sort_passed":37,"select_failures":0,"select_passed":115,"field_paths_failures":0,"field_paths_passed":2,"query_presets_failures":0,"query_presets_passed":11,"relationships_failures":0,"relationships_passed":57,"joins_failures":4,"joins_passed":70,"uploads_failures":2,"uploads_passed":100,"dataloader_failures":0,"dataloader_passed":4,"versions_failures":0,"versions_passed":98,"localization_failures":0,"localization_passed":117,"trash_failures":0,"trash_passed":97,"locked_documents_failures":0,"locked_documents_passed":13,"queues_failures":13,"queues_passed":59,"plugin_nested_docs_failures":1,"plugin_nested_docs_passed":0,"plugin_redirects_failures":0,"plugin_redirects_passed":3,"plugin_search_failures":1,"plugin_search_passed":19,"plugin_seo_failures":0,"plugin_seo_passed":6,"plugin_form_builder_failures":0,"plugin_form_builder_passed":53,"plugin_multi_tenant_failures":0,"plugin_multi_tenant_passed":9,"build_ok":1,"modularity_penalty":2225,"largest_src_file_lines":1397,"operations_lines":1397,"relationships_lines":731,"src_file_count":12,"large_src_files":3,"plugin_suites_enabled":1,"duration_s":1578.855},"status":"discard","description":"Resolve localized join path wrappers by locale","timestamp":1779881700573,"segment":2,"confidence":512.5,"asi":{"hypothesis":"Remaining localized join failures may come from resolving join.on paths through localized wrapper objects such as {en: [...]}; join value collection should select the request/default locale instead of failing path traversal or flattening all locales.","result":"Joins improved from 5 to 4 failures, but queues regressed noisily from best 11 to 13 and primary blocker_failures worsened from best 20 to 21.","rollback_reason":"Primary conformance metric worsened despite one join improvement, and the change increased relationships.ts size/modularity penalty. Under the full 1.0 rubric it cannot be kept alone.","next_action_hint":"Localized join wrapper handling is promising but needs to be combined with a net primary improvement or queue stabilization. Consider targeting queues/plugin_nested_docs/plugin_search remaining failure next, or reapply localized join handling only with an additional fix that offsets queue noise."}}
{"run":51,"commit":"daa0b52","metric":19,"metrics":{"database_failures":0,"database_passed":153,"auth_failures":0,"auth_passed":66,"globals_failures":0,"globals_passed":13,"collections_rest_failures":0,"collections_rest_passed":112,"collections_graphql_failures":0,"collections_graphql_passed":47,"fields_failures":0,"fields_passed":157,"sort_failures":0,"sort_passed":37,"select_failures":0,"select_passed":115,"field_paths_failures":0,"field_paths_passed":2,"query_presets_failures":0,"query_presets_passed":11,"relationships_failures":0,"relationships_passed":57,"joins_failures":4,"joins_passed":70,"uploads_failures":2,"uploads_passed":100,"dataloader_failures":0,"dataloader_passed":4,"versions_failures":0,"versions_passed":98,"localization_failures":0,"localization_passed":117,"trash_failures":0,"trash_passed":97,"locked_documents_failures":0,"locked_documents_passed":13,"queues_failures":11,"queues_passed":61,"plugin_nested_docs_failures":1,"plugin_nested_docs_passed":0,"plugin_redirects_failures":0,"plugin_redirects_passed":3,"plugin_search_failures":1,"plugin_search_passed":19,"plugin_seo_failures":0,"plugin_seo_passed":6,"plugin_form_builder_failures":0,"plugin_form_builder_passed":53,"plugin_multi_tenant_failures":0,"plugin_multi_tenant_passed":9,"build_ok":1,"modularity_penalty":2222,"largest_src_file_lines":1397,"operations_lines":1397,"relationships_lines":728,"src_file_count":12,"large_src_files":3,"plugin_suites_enabled":1,"duration_s":1592.055},"status":"keep","description":"Use default locale when resolving localized join wrappers","timestamp":1779883505849,"segment":2,"confidence":513,"asi":{"hypothesis":"Localized join.on paths can traverse localized wrapper objects like {en: [...]} before the relationship field segment. Resolving those wrappers with Payload's default locale should allow default-locale join population without flattening unrelated locales.","result":"blocker_failures improved from best 20 to 19. joins improved from 5 to 4 failures while queues stayed at the best observed 11 failures. All green guardrails stayed green.","learned":"A minimal default-locale localized wrapper resolution is enough to fix one localized join case without passing request locale through the full relationship read API. The broader request-locale variant also improved joins but was noisier and more invasive.","next_action_hint":"Remaining joins failures are likely explicit non-default locale localized joins, GraphQL group join pagination timeout, and collection-array ordering. Consider extending locale-aware join resolution only where request locale is safely available, or focus plugin_search remaining deleteDrafts failure / plugin_nested_docs setup timeout / queues lifecycle."}}
